No.,title,link,Affiliation,Author in JPN,Author in ENG
1,Turning Pointをもつ線型常微分方程式について (常微分方程式の解の定性的研究会報告集),http://www.kurims.kyoto-u.ac.jp/~kyodo/kokyuroku/contents/pdf/0105-01.pdf,東京工業大学理学部,中野 実,"NAKANO,MINORU"
2,On a Extension Theorem for Turning Point Problems (常微分方程式の解の定性的研究会報告集),http://www.kurims.kyoto-u.ac.jp/~kyodo/kokyuroku/contents/pdf/0105-02.pdf,千葉大学理学部,西本 敏彦,"NISHIMOTO,TOSHIHIKO"
3,差分微分方程式の解の漸近的性質 (常微分方程式の解の定性的研究会報告集),http://www.kurims.kyoto-u.ac.jp/~kyodo/kokyuroku/contents/pdf/0105-03.pdf,山梨大学工学部,栗原 光信,"KURIHARA,MITSUNOBU"
4,ニ点接続問題 (常微分方程式の解の定性的研究会報告集),http://www.kurims.kyoto-u.ac.jp/~kyodo/kokyuroku/contents/pdf/0105-04.pdf,広島大学理学部,河野 實彦,"KONO,MITSUHIKO"
5,An Extension of Gauss' Formula for Hypergeometric Series (常微分方程式の解の定性的研究会報告集),http://www.kurims.kyoto-u.ac.jp/~kyodo/kokyuroku/contents/pdf/0105-05.pdf,東京都立大学理学部,大久保 謙二郎,"OKUBO,KENJIRO"
6,有界な解と安定な領域 (常微分方程式の解の定性的研究会報告集),http://www.kurims.kyoto-u.ac.jp/~kyodo/kokyuroku/contents/pdf/0105-06.pdf,東京都立大学理学部,岩野 正宏,"IWANO,MASAHIRO"
