No.,title,link,Affiliation,Author in JPN,Author in ENG
1,An $\varepsilon$-Equilibrium Point of the Fractional Game (Nonlinear Analysis and Convex Analysis),http://www.kurims.kyoto-u.ac.jp/~kyodo/kokyuroku/contents/pdf/1136-1.pdf,"秋田県立大学経営システム工学科,秋田県立大学経営システム工学科,新潟工科大学情報電子工学科","木村 寛,星野 満博,田中 謙輔","Kimura,Yutaka,Hoshino,Mitsuhiro,Tanaka,Kensuke"
2,On the partial cooperative games (Nonlinear Analysis and Convex Analysis),http://www.kurims.kyoto-u.ac.jp/~kyodo/kokyuroku/contents/pdf/1136-2.pdf,"弘前大学理学研究科,弘前大学理工学部",",田中 環","Ayoshin,Dmitry A.,Tanaka,Tamaki"
3,Variational principles in Banach spaces and their parametrizations (Nonlinear Analysis and Convex Analysis),http://www.kurims.kyoto-u.ac.jp/~kyodo/kokyuroku/contents/pdf/1136-3.pdf,"Department of Mathematics and Informatics, Sofia University 'St. Kl. Ohridski'",,"Georgiev,Pando Gr."
4,非線形時系列解析によるカオス性検定 (非線形解析学と凸解析学の研究),http://www.kurims.kyoto-u.ac.jp/~kyodo/kokyuroku/contents/pdf/1136-4.pdf,弘前大学理工学部知能機械システム工学科,宮野 尚哉,"Miyano,Takaya"
5,A weighted extension of Carleman's inequality (Nonlinear Analysis and Convex Analysis),http://www.kurims.kyoto-u.ac.jp/~kyodo/kokyuroku/contents/pdf/1136-5.pdf,"福岡教育大学,山形大学工学部","原 卓哉,高橋 眞映","Hara,Takuya,Takahasi,Sin-Ei"
6,Strong Convergence Theorems with Compact Domains (Nonlinear Analysis and Convex Analysis),http://www.kurims.kyoto-u.ac.jp/~kyodo/kokyuroku/contents/pdf/1136-6.pdf,東京工業大学情報理工学研究科,厚芝 幸子,"Atsushiba,Sachiko"
7,Banach空間における非拡大写像の不動点への強収束定理 (非線形解析学と凸解析学の研究),http://www.kurims.kyoto-u.ac.jp/~kyodo/kokyuroku/contents/pdf/1136-7.pdf,新潟大学自然科学研究科,鈴木 智成,"Suzuki,Tomonari"
8,点列的不動点近似法と制約可能性問題 (非線形解析学と凸解析学の研究),http://www.kurims.kyoto-u.ac.jp/~kyodo/kokyuroku/contents/pdf/1136-8.pdf,東京工業大学情報理工学研究科,高橋 渉,"Takahashi,Wataru"
9,鞍点型条件のもとでの発展方程式に対する周期解の存在について (非線形解析学と凸解析学の研究),http://www.kurims.kyoto-u.ac.jp/~kyodo/kokyuroku/contents/pdf/1136-9.pdf,"横浜国立大学工学部,横浜国立大学工学部","平野 載倫,塩路 直樹","Hirano,Norimichi,Shioji,Naoki"
10,Facial structure of convex sets and some applications (Nonlinear Analysis and Convex Analysis),http://www.kurims.kyoto-u.ac.jp/~kyodo/kokyuroku/contents/pdf/1136-10.pdf,北海道教育大学旭川校,小室 直人,"Komuro,Naoto"
11,Hlawka type inequalities in Banach spaces (Nonlinear Analysis and Convex Analysis),http://www.kurims.kyoto-u.ac.jp/~kyodo/kokyuroku/contents/pdf/1136-11.pdf,"岡山県立大学情報工学部,山形大学工学部,木更津工業高等専門学校情報工学科","高橋 泰嗣,高橋 眞映,和田 州平","Takahashi,Yasuji,Takahasi,Sin-Ei,Wada,Shuhei"
12,Correlation Dimensions of Quasi-Periodic Trajectories for Evolution Equations (Nonlinear Analysis and Convex Analysis),http://www.kurims.kyoto-u.ac.jp/~kyodo/kokyuroku/contents/pdf/1136-12.pdf,熊本大学工学部,内藤 幸一郎,"Naito,Koichiro"
13,Banach空間における最良近似度に関する逆問題 (非線形解析学と凸解析学の研究),http://www.kurims.kyoto-u.ac.jp/~kyodo/kokyuroku/contents/pdf/1136-13.pdf,琉球大学理学部,西白保 敏彦,"Nishishiraho,Toshihiko"
14,実連続関数に値をとる微分可能な写像のHyers-Ulam stabilityについて (非線形解析学と凸解析学の研究),http://www.kurims.kyoto-u.ac.jp/~kyodo/kokyuroku/contents/pdf/1136-14.pdf,"新潟大学自然科学研究科,山形大学工学部,大阪教育大学","三浦 毅,高橋 眞映,長田 尚","Miura,Takeshi,Takahasi,Sin-Ei,Choda,Hisashi"
15,ON ABSOLUTE NORMS ON $\Bbb{C}^2$ : the Geometric Aspect (Nonlinear Analysis and Convex Analysis),http://www.kurims.kyoto-u.ac.jp/~kyodo/kokyuroku/contents/pdf/1136-15.pdf,"九州工業大学工学部,新潟大学理学部,岡山県立大学情報工学部","加藤 幹雄,斎藤 吉助,高橋 泰嗣","Kato,Mikio,Saito,Kichi-Suke,Takahashi,Yasuji"
16,DIRICHLET METHOD OF SUMMABILITY AND NONLINEAR ERGODIC THEOREMS IN HILBERT SPACE (Nonlinear Analysis and Convex Analysis),http://www.kurims.kyoto-u.ac.jp/~kyodo/kokyuroku/contents/pdf/1136-16.pdf,東洋大学工学部,吉本 武史,"Yoshimoto,Takehi"
17,逆凸計画問題に対する降下法を用いた内部近似法 (非線形解析学と凸解析学の研究),http://www.kurims.kyoto-u.ac.jp/~kyodo/kokyuroku/contents/pdf/1136-17.pdf,"大阪大学工学研究科,大阪大学工学研究科,大阪大学工学研究科","山田 修司,谷野 哲三,乾口 雅弘","Yamada,Syuuji,Tanino,Tetsuzo,Inuiguchi,Masahiro"
18,Observation on Set Optimization with Set-Valued Maps (Nonlinear Analysis and Convex Analysis),http://www.kurims.kyoto-u.ac.jp/~kyodo/kokyuroku/contents/pdf/1136-18.pdf,島根大学総合理工学部,黒岩 大史,"Kuroiwa,Daishi"
19,フラクタル図形作製法に対する不動点理論的定式化 (非線形解析学と凸解析学の研究),http://www.kurims.kyoto-u.ac.jp/~kyodo/kokyuroku/contents/pdf/1136-19.pdf,新潟大学理学部数学科,明石 重男,"Akashi,Shigeo"
