No.,title,link,Affiliation,Author in JPN,Author in ENG
1,With Tosio Kato at Berkeley (Tosio Kato's Method and Principle for Evolution Equations in Mathematical Physics),http://www.kurims.kyoto-u.ac.jp/~kyodo/kokyuroku/contents/pdf/1234-1.pdf,,,"Cordes,H.O."
2,Discretization of Layer Potentials and Numerical Methods for Water Waves (Tosio Kato's Method and Principle for Evolution Equations in Mathematical Physics),http://www.kurims.kyoto-u.ac.jp/~kyodo/kokyuroku/contents/pdf/1234-2.pdf,"Mathematics Department, Duke University",,"Beale,J. Thomas"
3,Incompressible Navier-Stokes equations in abstract Banach spaces (Tosio Kato's Method and Principle for Evolution Equations in Mathematical Physics),http://www.kurims.kyoto-u.ac.jp/~kyodo/kokyuroku/contents/pdf/1234-3.pdf,"Universite de Marne-la-Vallee, Equipe d'Analyse et de Mathematiques Appliquees,Instytut Matematyczny, Uniwersytet Wroclawski",",","Cannone,Marco,Karch,Grzegorz"
4,On the Well-Posedness of the Euler Equations in the Besov and the Triebel-Lizorkin Spaces (Tosio Kato's Method and Principle for Evolution Equations in Mathematical Physics),http://www.kurims.kyoto-u.ac.jp/~kyodo/kokyuroku/contents/pdf/1234-4.pdf,"Department of Mathematics, Seoul National University",,"Chae,Dongho"
5,Asymptotic behaviour and net force for the Navier-Stokes flows in exterior domains (Tosio Kato's Method and Principle for Evolution Equations in Mathematical Physics),http://www.kurims.kyoto-u.ac.jp/~kyodo/kokyuroku/contents/pdf/1234-5.pdf,",東北大学理学部",",小薗 英雄","Choe,Hi Jun,Kozono,Hideo"
6,Variational Inequalities and Nonlinear Semi-groups Applied to Certain Nonlinear Problems for the Stokes Equation (Tosio Kato's Method and Principle for Evolution Equations in Mathematical Physics),http://www.kurims.kyoto-u.ac.jp/~kyodo/kokyuroku/contents/pdf/1234-6.pdf,東海大学教育開発研究所,藤田 宏,"Fujita,Hiroshi"
7,On the two-dimensional nonstationary vorticity equations (Tosio Kato's Method and Principle for Evolution Equations in Mathematical Physics),http://www.kurims.kyoto-u.ac.jp/~kyodo/kokyuroku/contents/pdf/1234-7.pdf,北海道大学理学研究科,儀我 美一,"Giga,Yoshikazu"
8,"Resolvent Formulas, Special and General (Tosio Kato's Method and Principle for Evolution Equations in Mathematical Physics)",http://www.kurims.kyoto-u.ac.jp/~kyodo/kokyuroku/contents/pdf/1234-8.pdf,学習院大学理学部,黒田 成俊,"Kuroda,S.T."
9,Scattering problem for nonlinear Schrodinger and Hartree equations (Tosio Kato's Method and Principle for Evolution Equations in Mathematical Physics),http://www.kurims.kyoto-u.ac.jp/~kyodo/kokyuroku/contents/pdf/1234-9.pdf,"名古屋大学多元数理科学研究科,北海道大学理学研究科","中西 賢次,小澤 徹","Nakanishi,Kenji,Ozawa,Tohru"
10,ANALYTIC SMOOTHING EFFECT FOR THE BENJAMIN-ONO EQUATION (Tosio Kato's Method and Principle for Evolution Equations in MathematicalPhysics),http://www.kurims.kyoto-u.ac.jp/~kyodo/kokyuroku/contents/pdf/1234-10.pdf,九州大学数理学研究院,小川 卓克,"Ogawa,Takayoshi"
11,Comparison between the Boussinesq and coupled Euler equations in two dimensions (Tosio Kato's Method and Principle for Evolution Equations in Mathematical Physics),http://www.kurims.kyoto-u.ac.jp/~kyodo/kokyuroku/contents/pdf/1234-11.pdf,京都大学数理解析研究所,大木谷 耕司,"Ohkitani,Koji"
12,ON A STABILITY THEOREM OF THE NAVIER-STOKES EQUATION IN A THREE DIMENSIONAL EXTERIOR DOMAIN (Tosio Kato's Method and Principle for Evolution Equations in Mathematical Physics),http://www.kurims.kyoto-u.ac.jp/~kyodo/kokyuroku/contents/pdf/1234-12.pdf,早稲田大学理工学部,柴田 良弘,"Shibata,Yoshihiro"
13,NONLINEAR INSTABILITY OF DISPERSIVE WAVES (Tosio Kato's Method and Principle for Evolution Equations in Mathematical Physics),http://www.kurims.kyoto-u.ac.jp/~kyodo/kokyuroku/contents/pdf/1234-13.pdf,Brown Univ.,,"Strauss,Walter A."
14,Strichartz inequality and smoothing property for Schrodinger equations with potential superquadratic at infinity (Tosio Kato's Method and Principle for Evolution Equations in Mathematical Physics),http://www.kurims.kyoto-u.ac.jp/~kyodo/kokyuroku/contents/pdf/1234-14.pdf,"東京大学数理科学研究科,東京大学数理科学研究科",谷島 賢二,"Yajima,Kenji,Zhang,Guoping"
15,On the Stokes and Navier-Stokes flows between parallel planes (Tosio Kato's Method and Principle for Evolution Equations in Mathematical Physics),http://www.kurims.kyoto-u.ac.jp/~kyodo/kokyuroku/contents/pdf/1234-15.pdf,早稲田大学理工学部,阿部 孝之,"Abe,Takayuki"
16,ON THE CAUCHY PROBLEM IN THE MAXWELL-CHERN-SIMONS-HIGGS SYSTEM (Tosio Kato's Method and Principle for Evolution Equations in Mathematical Physics),http://www.kurims.kyoto-u.ac.jp/~kyodo/kokyuroku/contents/pdf/1234-16.pdf,"Department of Mathematics, Seoul National University,Department on Mathematics, Seoul National University",",","Chae,Dongho,Chae,Myeongju"
17,On the Cauchy problem of the Chern-Simons-Higgs theory (Tosio Kato's Method and Principle for Evolution Equations in Mathematical Physics),http://www.kurims.kyoto-u.ac.jp/~kyodo/kokyuroku/contents/pdf/1234-17.pdf,"Department of Mathematics, Seoul National University,Department of Mathematics, Seoul National University",",","Chae,Dongho,Choe,Kwangseok"
18,Two-Dimensional Navier-Stokes Flow with Nondecaying Initial Velocity (Tosio Kato's Method and Principle for Evolution Equations in Mathematical Physics),http://www.kurims.kyoto-u.ac.jp/~kyodo/kokyuroku/contents/pdf/1234-18.pdf,"北海道大学理学研究科,北海道情報大学,北海道大学理学研究科","儀我 美一,松井 伸也,沢田 宙広","Giga,Yoshikazu,Matsui,Shin'ya,Sawada,Okihiro"
19,Weighted Strichartz estimates and existence of self-similar solutions for semilinear wave equations (Tosio Kato's Method and Principle for Evolution Equations in Mathematical Physics),http://www.kurims.kyoto-u.ac.jp/~kyodo/kokyuroku/contents/pdf/1234-19.pdf,"北海道大学理学研究科,北海道大学理学研究科","加藤 淳,小澤 徹","Kato,Jun,Ozawa,Tohru"
20,Blow-up problems modeled from the strain-vorticity dynamics (Tosio Kato's Method and Principle for Evolution Equations in Mathematical Physics),http://www.kurims.kyoto-u.ac.jp/~kyodo/kokyuroku/contents/pdf/1234-20.pdf,"京都大学数理解析研究所,京都大学数理解析研究所","大木谷 耕司,岡本 久","Ohkitani,Koji,Okamoto,Hisashi"
21,ON THE STEADY FLOW OF COMPRESSIBLE VISCOUS FLUID AND ITS STABILITY WITH RESPECT TO INITIAL DISTURBANCE (Tosio Kato's Method and Principle for Evolution Equations in Mathematical Physics),http://www.kurims.kyoto-u.ac.jp/~kyodo/kokyuroku/contents/pdf/1234-21.pdf,早稲田大学理工学部,田中 孝明,"Tanaka,Koumei"
22,Professor Tosio Kato (Tosio Kato's Method and Principle for Evolution Equations in Mathematical Physics),http://www.kurims.kyoto-u.ac.jp/~kyodo/kokyuroku/contents/pdf/1234-22.pdf,,,
23,Two manuscripts left by late Professor Tosio Kato in his personal computer (Tosio Kato's Method and Principle for Evolution Equations in Mathematical Physics),http://www.kurims.kyoto-u.ac.jp/~kyodo/kokyuroku/contents/pdf/1234-23.pdf,,,
24,Untitled Manuscript (Tosio Kato's Method and Principle for Evolution Equations in Mathematical Physics),http://www.kurims.kyoto-u.ac.jp/~kyodo/kokyuroku/contents/pdf/1234-24.pdf,,,
25,A remark on the 2D-Euler equation (Tosio Kato's Method and Principle for Evolution Equations in Mathematical Physics),http://www.kurims.kyoto-u.ac.jp/~kyodo/kokyuroku/contents/pdf/1234-25.pdf,,,
26,Publications of Tosio Kato (Tosio Kato's Method and Principle for Evolution Equations in Mathematical Physics),http://www.kurims.kyoto-u.ac.jp/~kyodo/kokyuroku/contents/pdf/1234-26.pdf,,,
