No.,title,link,Affiliation,Author in JPN,Author in ENG
1,$8_3$結び目のA-多項式について (Volume Conjectureとその周辺),http://www.kurims.kyoto-u.ac.jp/~kyodo/kokyuroku/contents/pdf/1279-1.pdf,東京都立大学理学研究科数学専攻,"田村 奈穂子,横田 佳之","Tamura,Naoko,Yokota,Yoshiyuki"
2,"ON ALGEBRAIC $K$-THEORY, HOMOLOGY SPHERES AND THE $\eta$-INVARIANT (Volume Conjecture and Its Related Topics)",http://www.kurims.kyoto-u.ac.jp/~kyodo/kokyuroku/contents/pdf/1279-2.pdf,東京農工大学工学部数学教室,森藤 孝之,"Morifuji,Takayuki"
3,D. Zagier論文「Vassiliev invariants and a strange identity related to the Dedekind eta-function」の紹介 (Volume Conjectureとその周辺),http://www.kurims.kyoto-u.ac.jp/~kyodo/kokyuroku/contents/pdf/1279-3.pdf,九州大学数理学府,伊原 健太郎,"Ihara,Kentaro"
4,Logarithmic Correction of Kashaev's Invariant (Volume Conjecture and Its Related Topics),http://www.kurims.kyoto-u.ac.jp/~kyodo/kokyuroku/contents/pdf/1279-4.pdf,東京大学理学系研究科物理学専攻,樋上 和弘,"Hikami,Kazuhiro"
5,Actual computation for the complexified hyperbolic volume conjecture (Volume Conjecture and Its Related Topics),http://www.kurims.kyoto-u.ac.jp/~kyodo/kokyuroku/contents/pdf/1279-5.pdf,早稲田大学理工学部,村上 順,"Murakami,Jun"
6,MAHLER MEASURE OF THE COLORED JONES POLYNOMIAL AND THE VOLUME CONJECTURE (Volume Conjecture and Its Related Topics),http://www.kurims.kyoto-u.ac.jp/~kyodo/kokyuroku/contents/pdf/1279-6.pdf,東京工業大学理工学研究科,村上 斉,"Murakami,Hitoshi"
7,"$PSL(2,\rm{Z})$の有限型不変量について (Volume Conjectureとその周辺)",http://www.kurims.kyoto-u.ac.jp/~kyodo/kokyuroku/contents/pdf/1279-7.pdf,東京工業大学理工学研究科数学専攻,水摩 陽子,"Mizuma,Yoko"
