No.,title,link,Affiliation,Author in JPN,Author in ENG
1,正標数代数曲線の被覆に関する数論幾何 (代数的整数論とその周辺),http://www.kurims.kyoto-u.ac.jp/~kyodo/kokyuroku/contents/pdf/1324-1.pdf,京都大学数理解析研究所,玉川  安騎男,"Tamagawa, Akio"
2,Analytic Truncation and Rankin-Selberg versus Algebraic Truncation and Non-Abelian Zeta (Algebraic Number Theory and Related Topics),http://www.kurims.kyoto-u.ac.jp/~kyodo/kokyuroku/contents/pdf/1324-2.pdf,九州大学数理学研究科,,"Weng, Lin"
3,素数判定の決定的多項式時間アルゴリズム (代数的整数論とその周辺),http://www.kurims.kyoto-u.ac.jp/~kyodo/kokyuroku/contents/pdf/1324-3.pdf,電気通信大学,木田  雅成,"Kida, Masanari"
4,Introduction to p-adic multiple zeta values (Algebraic Number Theory and Related Topics),http://www.kurims.kyoto-u.ac.jp/~kyodo/kokyuroku/contents/pdf/1324-4.pdf,京都大学数理解析研究所,古庄  英和,"Furusho, Hidekazu"
5,$p$-adic analogue of Shintani's formula (Algebraic Number Theory and Related Topics),http://www.kurims.kyoto-u.ac.jp/~kyodo/kokyuroku/contents/pdf/1324-5.pdf,京都大学理学部,加塩  朋和,"Kashio, Tomokazu"
6,超特異な素点における保型形式の岩澤理論 (代数的整数論とその周辺),http://www.kurims.kyoto-u.ac.jp/~kyodo/kokyuroku/contents/pdf/1324-6.pdf,東京大学数理科学研究科,小林  真一,"Kobayashi, Shin-ichi"
7,On a normal integral basis problem over cyclotomic $\mathbb{Z}_p$-extensions (Algebraic Number Theory and Related Topics),http://www.kurims.kyoto-u.ac.jp/~kyodo/kokyuroku/contents/pdf/1324-7.pdf,横浜市立大学理学部,市村  文男,"Ichimura, Humio"
8,実2次体の円分$\mathbb{Z}_2$-拡大と最大不分岐pro-2-拡大について (代数的整数論とその周辺),http://www.kurims.kyoto-u.ac.jp/~kyodo/kokyuroku/contents/pdf/1324-8.pdf,早稲田大学理工学研究科数理科学専攻,水澤  靖,"Mizusawa, Yasushi"
9,Higher Arithmetic $K$-theory (Algebraic Number Theory and Related Topics),http://www.kurims.kyoto-u.ac.jp/~kyodo/kokyuroku/contents/pdf/1324-9.pdf,九州大学数理学研究院,竹田  雄一郎,"Takeda, Yuichiro"
10,POLYLOGARITHMS AND MIXED MOTIVES (Algebraic Number Theory and Related Topics),http://www.kurims.kyoto-u.ac.jp/~kyodo/kokyuroku/contents/pdf/1324-10.pdf,東北大学理学研究科,花村  昌樹,"Hanamura, Masaki"
11,Exact Hermitian Cubes and the Zagier Conjecture (Algebraic Number Theory and Related Topics),http://www.kurims.kyoto-u.ac.jp/~kyodo/kokyuroku/contents/pdf/1324-11.pdf,九州大学数理学研究院,竹田  雄一郎,"Takeda, Yuichiro"
12,$K$群のColeman巾級数とexplicit reciprocity law (代数的整数論とその周辺),http://www.kurims.kyoto-u.ac.jp/~kyodo/kokyuroku/contents/pdf/1324-12.pdf,東京大学数理科学研究科,深谷  太香子,"Fukaya, Takako"
13,$p$-ADIC ETALE COHOMOLOGY AND CRYSTALLINE COHOMOLOGY FOR OPEN VARIETIES (Algebraic Number Theory and Related Topics),http://www.kurims.kyoto-u.ac.jp/~kyodo/kokyuroku/contents/pdf/1324-13.pdf,東京大学数理科学研究科,山下  剛,"Yamashita, Go"
14,剰余体が完全とは限らない局所体の分岐群 : A. Abbes氏との共同研究 (代数的整数論とその周辺),http://www.kurims.kyoto-u.ac.jp/~kyodo/kokyuroku/contents/pdf/1324-14.pdf,東京大学数理科学研究科,斎藤  毅,"Saito, Takeshi"
15,Canonical subgroups and $p$-adic vanishing cycles on abelian varieties (Algebraic Number Theory and Related Topics),http://www.kurims.kyoto-u.ac.jp/~kyodo/kokyuroku/contents/pdf/1324-15.pdf,"Institut Galilee, Universite Paris-Nord",,"Abbes, Ahmed"
16,Heegner points and Hilbert modular forms (Algebraic Number Theory and Related Topics),http://www.kurims.kyoto-u.ac.jp/~kyodo/kokyuroku/contents/pdf/1324-16.pdf,"McGill Univ., Centre Interuniversitaire de Calcul Mathematique Algebrique,McGill Univ., Centre Interuniversitaire de Calcul Mathematique Algebrique",",","Darmon, Henri,Logan, Adam"
17,Universal bound for isogenies of elliptic curves over number fields (Algebraic Number Theory and Related Topics),http://www.kurims.kyoto-u.ac.jp/~kyodo/kokyuroku/contents/pdf/1324-17.pdf,東京大学数理科学研究科,河村  隆,"Kawamura, Takashi"
18,量指標に付随するHecke $L$関数の値分布について (代数的整数論とその周辺),http://www.kurims.kyoto-u.ac.jp/~kyodo/kokyuroku/contents/pdf/1324-18.pdf,名古屋大学多元数理科学研究科,見正  秀彦,"Mishou, Hidehiko"
19,GREEN CURRENTS FOR MODULAR CYCLES IN ARITHMETIC QUOTIENTS OF COMPLEX HYPERBALLS (Algebraic Number Theory and Related Topics),http://www.kurims.kyoto-u.ac.jp/~kyodo/kokyuroku/contents/pdf/1324-19.pdf,上智大学理工学部,都築  正男,"Tsuzuki, Masao"
20,Automorphic $L$-functions via Novodvorsky's integrals (Algebraic Number Theory and Related Topics),http://www.kurims.kyoto-u.ac.jp/~kyodo/kokyuroku/contents/pdf/1324-20.pdf,東京大学数理科学研究科,森山  知則,"Moriyama, Tomonori"
21,5次可移群に対する$Q$上2助変数生成的多項式の構成 (代数的整数論とその周辺),http://www.kurims.kyoto-u.ac.jp/~kyodo/kokyuroku/contents/pdf/1324-21.pdf,"早稲田大学理工学部数理科学科,上智大学理工学部数学科","橋本  喜一朗,角皆  宏","Hashimoto, Ki-ichiro,Tsunogai, Hiroshi"
22,Quadratic reduction of multiplicative group and its applications (Algebraic Number Theory and Related Topics),http://www.kurims.kyoto-u.ac.jp/~kyodo/kokyuroku/contents/pdf/1324-22.pdf,大阪大学理学研究科,小川  裕之,"Ogawa, Hiroyuki"
