No.,title,link,Affiliation,Author in JPN,Author in ENG
1,波動方程式の解の$L^\infty$評価について (非線型双曲型方程式系の解の挙動に関する研究),http://www.kurims.kyoto-u.ac.jp/~kyodo/kokyuroku/contents/pdf/1331-1.pdf,北海道工業大学,横山  和義,"Yokoyama, Kazuyoshi"
2,非線形波動方程式系に対する存在定理 (非線型双曲型方程式系の解の挙動に関する研究),http://www.kurims.kyoto-u.ac.jp/~kyodo/kokyuroku/contents/pdf/1331-2.pdf,和歌山大学教育学部数学教室,片山  聡一郎,"Katayama, Soichiro"
3,半線形波動方程式系の解の爆発 (非線型双曲型方程式系の解の挙動に関する研究),http://www.kurims.kyoto-u.ac.jp/~kyodo/kokyuroku/contents/pdf/1331-3.pdf,静岡大学工学部,太田  雅人,"Ohta, Masahito"
4,半線型波動方程式系に対する存在定理 (非線型双曲型方程式系の解の挙動に関する研究),http://www.kurims.kyoto-u.ac.jp/~kyodo/kokyuroku/contents/pdf/1331-4.pdf,静岡大学工学部,久保  英夫,"Kubo, Hideo"
5,Appearance of singularities for a system of nonlinear wave equations with different speeds (On Global Behavior of Solutions for Nonlinear Hyperbolic Systems),http://www.kurims.kyoto-u.ac.jp/~kyodo/kokyuroku/contents/pdf/1331-5.pdf,東京理科大学理学部,加藤  圭一,"Kato, Keiichi"
6,Global small amplitude solutions to systems of nonlinear Klein-Gordon equations with several mass terms (On Global Behavior of Solutions for Nonlinear Hyperbolic Systems),http://www.kurims.kyoto-u.ac.jp/~kyodo/kokyuroku/contents/pdf/1331-6.pdf,大阪大学理学研究科,砂川  秀明,"Sunagawa, Hideaki"
7,GLOBAL EXISTENCE OF SOLUTIONS TO SYSTEMS OF WAVE EQUATIONS WITH DIFFERENT PORPAGATION SPEEDS IN ONE SPATIAL DIMENSION (On Global Behavior of Solutions for Nonlinear Hyperbolic Systems),http://www.kurims.kyoto-u.ac.jp/~kyodo/kokyuroku/contents/pdf/1331-7.pdf,東北大学理学研究科,津川  光太郎,"Tsugawa, Kotaro"
8,Geometric Blow up の方法 (非線型双曲型方程式系の解の挙動に関する研究),http://www.kurims.kyoto-u.ac.jp/~kyodo/kokyuroku/contents/pdf/1331-8.pdf,静岡大学工学部,星賀  彰,"Hoshiga, Akira"
