No.,title,link,Affiliation,Author in JPN,Author in ENG
1,Parabolic isometries of CAT(0) spaces and CAT(0) dimensions (Perspectives of Hyperbolic Spaces II),http://www.kurims.kyoto-u.ac.jp/~kyodo/kokyuroku/contents/pdf/1387-1.pdf,東北大学理学研究科数学専攻,藤原  耕二,"Fujiwara, Koji"
2,NOTE ON REALIZATION OF CUSP CROSS-SECTIONS OF COMPLEX HYPERBOLIC ORBIFOLDS (Perspectives of Hyperbolic Spaces II),http://www.kurims.kyoto-u.ac.jp/~kyodo/kokyuroku/contents/pdf/1387-2.pdf,東京都立大学理学研究科数学専攻,神島  芳宣,"Kamishima, Yoshinobu"
3,"NOTES ON DISCRETE SUBGROUPS OF PU(1,2;$\mathbf{C}$) WITH PARABOLIC ELEMENTS (Perspectives of Hyperbolic Spaces II)",http://www.kurims.kyoto-u.ac.jp/~kyodo/kokyuroku/contents/pdf/1387-3.pdf,岡山理科大学工学部,神谷  茂保,"Kamiya, Shigeyasu"
4,Deformations of hyperbolic structures on the figure eight knot complement and an elliptic curve associated to them (Perspectives of Hyperbolic Spaces II),http://www.kurims.kyoto-u.ac.jp/~kyodo/kokyuroku/contents/pdf/1387-4.pdf,京都大学理学研究科,藤井  道彦,"Fujii, Michihiko"
5,Strong convergence of Kleinian groups (Perspectives of Hyperbolic Spaces II),http://www.kurims.kyoto-u.ac.jp/~kyodo/kokyuroku/contents/pdf/1387-5.pdf,大阪大学理学研究科,大鹿  健一,"Ohshika, Ken'ichi"
6,A note on continuity of grafting maps (Perspectives of Hyperbolic Spaces II),http://www.kurims.kyoto-u.ac.jp/~kyodo/kokyuroku/contents/pdf/1387-6.pdf,名古屋大学多元数理科学研究科,糸  健太郎,"Ito, Kentaro"
7,A Variation of McShane's identity for punctured surface bundles (Perspectives of Hyperbolic Spaces II),http://www.kurims.kyoto-u.ac.jp/~kyodo/kokyuroku/contents/pdf/1387-7.pdf,"大阪大学理学研究科,大阪大学理学研究科,大阪大学理学研究科","秋吉  宏尚,宮地  秀樹,作間  誠","Akiyoshi, Hirotaka,Miyachi, Hideki,Sakuma, Makoto"
8,End invariants and Jorgensen's angle invariants of punctured torus groups (Perspectives of Hyperbolic Spaces II),http://www.kurims.kyoto-u.ac.jp/~kyodo/kokyuroku/contents/pdf/1387-8.pdf,大阪大学理学研究科,秋吉  宏尚,"Akiyoshi, Hirotaka"
9,1点穴あきトーラスから2点穴あきトーラスへ (双曲空間に関連する研究とその展望II),http://www.kurims.kyoto-u.ac.jp/~kyodo/kokyuroku/contents/pdf/1387-9.pdf,奈良女子大学理学部,和田  昌昭,"Wada, Masaaki"
10,クライン群の極限集合上での群同変な連続写像について (双曲空間に関連する研究とその展望II),http://www.kurims.kyoto-u.ac.jp/~kyodo/kokyuroku/contents/pdf/1387-10.pdf,東京電機大学理工学部,宮地  秀樹,"Miyachi, Hideki"
11,Dynamics of Teichmuller modular groups and general topology of moduli spaces : Announcement (Perspectives of Hyperbolic Spaces II),http://www.kurims.kyoto-u.ac.jp/~kyodo/kokyuroku/contents/pdf/1387-11.pdf,お茶の水女子大学理学部数学科,松崎  克彦,"Matsuzaki, Katsuhiko"
12,Biholomorphic maps between asymptotic Teichmuller spaces (Perspectives of Hyperbolic Spaces II),http://www.kurims.kyoto-u.ac.jp/~kyodo/kokyuroku/contents/pdf/1387-12.pdf,東京工業大学情報理工学研究科,藤川  英華,"Fujikawa, Ege"
13,BRAIDS AND NIELSEN-THURSTON TYPES OF AUTOMORPHISMS OF PUNCTURED SURFACES (Perspectives of Hyperbolic Spaces II),http://www.kurims.kyoto-u.ac.jp/~kyodo/kokyuroku/contents/pdf/1387-13.pdf,"大阪産業大学教養部,日本大学文理学部","市原  一裕,茂手木  公彦","Ichihara, Kazuhiro,Motegi, Kimihiko"
14,Searching for $\mathbb{Z+A}$ subgroups in non-hyperbolic automatic groups (Perspectives of Hyperbolic Spaces II),http://www.kurims.kyoto-u.ac.jp/~kyodo/kokyuroku/contents/pdf/1387-14.pdf,"龍谷大学経済学部,大阪産業大学教養学部,奈良女子大学理学部","中川  義行,田村  誠,山下  靖","Nakagawa, Yoshiyuki,Tamura, Makoto,Yamashita, Yasushi"
15,ON DIFFEOMORPHISMS OVER SURFACES IN THE COMPLEX PROJECTIVE PLANE (Perspectives of Hyperbolic Spaces II),http://www.kurims.kyoto-u.ac.jp/~kyodo/kokyuroku/contents/pdf/1387-15.pdf,佐賀大学理工学部数理科学科,廣瀬  進,"Hirose, Susumu"
16,On $L^2$-invariants of surface bundles (Perspectives of Hyperbolic Spaces II),http://www.kurims.kyoto-u.ac.jp/~kyodo/kokyuroku/contents/pdf/1387-16.pdf,東京農工大学工学部数学教室,森藤  孝之,"Morifuji, Takayuki"
17,ジョンソン準同型とトレリ群のコホモロジーについて (双曲空間に関連する研究とその展望II),http://www.kurims.kyoto-u.ac.jp/~kyodo/kokyuroku/contents/pdf/1387-17.pdf,東京大学数理科学研究科,逆井  卓也,"Sakasai, Takuya"
18,ロホリン不変量から定まるトレリ群のコホモロジー類について (双曲空間に関連する研究とその展望II),http://www.kurims.kyoto-u.ac.jp/~kyodo/kokyuroku/contents/pdf/1387-18.pdf,東京工業大学情報理工学研究科,北野  晃朗,"Kitano, Teruaki"
19,TWISTED FIRST HOMOLOGY GROUP OF THE AUTOMORPHISM GROUP OF A FREE GROUP (Perspectives of Hyperbolic Spaces II),http://www.kurims.kyoto-u.ac.jp/~kyodo/kokyuroku/contents/pdf/1387-19.pdf,東京大学数理科学研究科,佐藤  隆夫,"Sato, Takao"
20,楕円型作用素の同変行列式と群作用 (双曲空間に関連する研究とその展望II),http://www.kurims.kyoto-u.ac.jp/~kyodo/kokyuroku/contents/pdf/1387-20.pdf,東京海洋大学海洋科学部,坪井  堅二,"Tsuboi, Kenji"
21,Extreme discrete groups of parabolic type for Jorgensen's inequality (Perspectives of Hyperbolic Spaces II),http://www.kurims.kyoto-u.ac.jp/~kyodo/kokyuroku/contents/pdf/1387-21.pdf,"静岡大学理工学研究科,静岡大学理学部,静岡大学理学部","李  長軍,大市  牧人,佐藤  宏樹","Li, Changjun,Oichi, Makito,Sato, Hiroki"
22,Trace fields of genus 3 surfaces with regular fundamental polygons (Perspectives of Hyperbolic Spaces II),http://www.kurims.kyoto-u.ac.jp/~kyodo/kokyuroku/contents/pdf/1387-22.pdf,愛知工業大学工学部,中村  豪,"Nakamura, Gou"
23,Hyperbolically maximal domains on Riemann surfaces (Perspectives of Hyperbolic Spaces II),http://www.kurims.kyoto-u.ac.jp/~kyodo/kokyuroku/contents/pdf/1387-23.pdf,"山口大学理学部,広島大学工学研究科","増本  誠,柴  雅和","Masumoto, Makoto,Siba, Masakakzu"
24,ON HYPERBOLIC CALCULUS (Perspectives of Hyperbolic Spaces II),http://www.kurims.kyoto-u.ac.jp/~kyodo/kokyuroku/contents/pdf/1387-24.pdf,広島大学理学研究科,須川  敏幸,"Sugawa, Toshiyuki"
