No.,title,link,Affiliation,Author in JPN,Author in ENG
1,モンスターのmaximal local subgroupsの分類とその応用 (有限単純群の研究とその周辺),http://www.kurims.kyoto-u.ac.jp/~kyodo/kokyuroku/contents/pdf/1407-1.pdf,東京女子大学文理学部数理学科,吉荒  聡,"Yoshiara, Satoshi"
2,可換アソシエーションスキームの指標理論 (有限単純群の研究とその周辺),http://www.kurims.kyoto-u.ac.jp/~kyodo/kokyuroku/contents/pdf/1407-2.pdf,九州大学数理学府,田中  太初,"Tanaka, Hajime"
3,The radical $p$-subgroups and the relative projectivity (Finite Simple Groups and Related Topics),http://www.kurims.kyoto-u.ac.jp/~kyodo/kokyuroku/contents/pdf/1407-3.pdf,鳴門教育大学数学教育講座,澤辺  正人,"Sawabe, Masato"
4,有限単純群の素数グラフ (有限単純群の研究とその周辺),http://www.kurims.kyoto-u.ac.jp/~kyodo/kokyuroku/contents/pdf/1407-4.pdf,熊本大学自然科学研究科,八牧  宏美,"Yamaki, Hiroyoshi"
5,On P. Hall's Relations in Finite groups (II) (Finite Simple Groups and Related Topics),http://www.kurims.kyoto-u.ac.jp/~kyodo/kokyuroku/contents/pdf/1407-5.pdf,室蘭工業大学,竹ヶ原  裕元,"Takegahara, Yugen"
6,Vertex Operator Algebra for Finite Group Theory (Finite Simple Groups and Related Topics),http://www.kurims.kyoto-u.ac.jp/~kyodo/kokyuroku/contents/pdf/1407-6.pdf,筑波大学数学系,宮本  雅彦,"Miyamoto, Masahiko"
7,一般素数グラフについて (有限単純群の研究とその周辺),http://www.kurims.kyoto-u.ac.jp/~kyodo/kokyuroku/contents/pdf/1407-7.pdf,山口大学教育学部,飯寄  信保,"Iiyori, Nobuo"
8,On maximal local subgroups of finite simple groups (Finite Simple Groups and Related Topics),http://www.kurims.kyoto-u.ac.jp/~kyodo/kokyuroku/contents/pdf/1407-8.pdf,室蘭工業大学,千吉良  直紀,"Chigira, Naoki"
9,Fischer空間に附随する非結合的代数と頂点作用素代数 (有限単純群の研究とその周辺),http://www.kurims.kyoto-u.ac.jp/~kyodo/kokyuroku/contents/pdf/1407-9.pdf,東京大学数理科学研究科,松尾  厚,"Matsuo, Atsushi"
