No.,title,link,Affiliation,Author in JPN,Author in ENG
1,ファインマン・パラメーター積分公式と摂動論における解析性(場の量子論の研究),http://www.kurims.kyoto-u.ac.jp/~kyodo/kokyuroku/contents/pdf/1524-1.pdf,京都大学名誉教授,中西 襄,"Nakanishi, Noboru"
2,場の理論における複合粒子(場の量子論の研究),http://www.kurims.kyoto-u.ac.jp/~kyodo/kokyuroku/contents/pdf/1524-2.pdf,,,西島 和彦
3,ベーテ・サルピータ方程式の特異性と連続固有値(場の量子論の研究),http://www.kurims.kyoto-u.ac.jp/~kyodo/kokyuroku/contents/pdf/1524-3.pdf,大阪大学大学院理学研究科,東島 清,"Higashijima, Kiyoshi"
4,On the consistency between Schwinger-Dyson Equation and Bethe-Salpeter Equation(Research in Quantum Field Theory),http://www.kurims.kyoto-u.ac.jp/~kyodo/kokyuroku/contents/pdf/1524-4.pdf,"Yukawa Institute for Theoretical Physics, Kyoto University",,"KUGO, Taichiro"
5,"Nakanishi-Lautrup $B$-Field, Crossed Product & Duality(Research in Quantum Field Theory)",http://www.kurims.kyoto-u.ac.jp/~kyodo/kokyuroku/contents/pdf/1524-5.pdf,京都大学数理解析研究所,小嶋 泉,"Ojima, Izumi"
6,量子重力の共変演算子形式とトポロジカルな toy model(場の量子論の研究),http://www.kurims.kyoto-u.ac.jp/~kyodo/kokyuroku/contents/pdf/1524-6.pdf,立命館大学理工学部,池田 憲明,"Ikeda, Noriaki"
7,量子優先の原理と時空構造(場の量子論の研究),http://www.kurims.kyoto-u.ac.jp/~kyodo/kokyuroku/contents/pdf/1524-7.pdf,京都大学名誉教授,中西 襄,"Nakanishi, Noboru"
8,Heisenberg 描像における場の量子論の解法(場の量子論の研究),http://www.kurims.kyoto-u.ac.jp/~kyodo/kokyuroku/contents/pdf/1524-8.pdf,京都大学数理解析研究所,阿部 光雄,"Abe, Mitsuo"
9,数理物理学研究回顧(場の量子論の研究),http://www.kurims.kyoto-u.ac.jp/~kyodo/kokyuroku/contents/pdf/1524-9.pdf,京都大学名誉教授,,中西 襄
