No.,title,link,Affiliation,Author in JPN,Author in ENG
1,PROBLEMS ON QUANTUM GROUPS (Problems in theory of operator algebras),http://www.kurims.kyoto-u.ac.jp/~kyodo/kokyuroku/contents/pdf/1627-01.pdf,東京大学数理解析研究科,戸松 玲治,"TOMATSU,Reiji"
2,Cuntz-Krieger環の生成元達の組み合わせ論的性質と関連する力学系のゼータ関数について (作用素環論における諸問題),http://www.kurims.kyoto-u.ac.jp/~kyodo/kokyuroku/contents/pdf/1627-02.pdf,横浜市立大学国際総合科学研究科,松本 健吾,"Matsumoto,Kengo"
3,算術平均・幾何平均不等式の非可換化について (作用素環論における諸問題),http://www.kurims.kyoto-u.ac.jp/~kyodo/kokyuroku/contents/pdf/1627-03.pdf,名古屋工業大学,林 倫弘,"Hayashi,Tomohiro"
4,Non-separable UHF algebras (Problems in theory of operator algebras),http://www.kurims.kyoto-u.ac.jp/~kyodo/kokyuroku/contents/pdf/1627-04.pdf,慶應義塾大学理工学部,勝良 健史,"Katsura,Takeshi"
5,INDECOMPOSABILITY RESULTS FOR AMALGAMATED FREE PRODUCTS OF VON NEUMANN ALGEBRAS (Problems in theory of operator algebras),http://www.kurims.kyoto-u.ac.jp/~kyodo/kokyuroku/contents/pdf/1627-05.pdf,"MATH DEPT, UCLA",,"HOUDAYER,CYRIL"
6,HAAGERUP PROPERTY FOR WREATH PRODUCTS (Problems in theory of operator algebras),http://www.kurims.kyoto-u.ac.jp/~kyodo/kokyuroku/contents/pdf/1627-06.pdf,"IRMAR, CAMPUS DE BEAULIEU",,"CORNULIER,YVES DE"
7,Certain aperiodic automorphisms of unital simple projectionless $C^*$-algebras (Problems in theory of operator algebras),http://www.kurims.kyoto-u.ac.jp/~kyodo/kokyuroku/contents/pdf/1627-07.pdf,北海道大学理学院数学科,佐藤 康彦,"Sato,Yasuhiko"
8,MEASURABLE RIGIDITY FOR SOME AMALGAMATED FREE PRODUCTS (Problems in theory of operator algebras),http://www.kurims.kyoto-u.ac.jp/~kyodo/kokyuroku/contents/pdf/1627-08.pdf,東北大学理学研究科,木田 良才,"KIDA,YOSHIKATA"
