No.,title,link,Affiliation,Author in JPN,Author in ENG
1,p-SetによるFunction Algebraの分解について (Function Algebra),http://www.kurims.kyoto-u.ac.jp/~kyodo/kokyuroku/contents/pdf/0169-01.pdf,北海道大学理学部,林 実樹広,"HAYASHI,MIKIHIRO"
2,Linear Extension Operatorについて (Function Algebra),http://www.kurims.kyoto-u.ac.jp/~kyodo/kokyuroku/contents/pdf/0169-02.pdf,早稲田大学教育学部,和田 淳藏,"WADA,JUNZO"
3,測度代数のL-イデアルについて (Function Algebra),http://www.kurims.kyoto-u.ac.jp/~kyodo/kokyuroku/contents/pdf/0169-03.pdf,"北海道大学応用電気研究所,東京教育大学理学部","清水 誓宏,泉池 敬司","SHIMIZU,SEIKO,IZUCHI,KEIJI"
4,不変部分空間に関する最近の話題 : 無限多重連結領域上の正則函数のイデアル及び部分加群に関するC.W.Nevilleの結果 (Function Algebra),http://www.kurims.kyoto-u.ac.jp/~kyodo/kokyuroku/contents/pdf/0169-04.pdf,茨城大学理学部,荷見 守助,"HASUMI,MORISUKE"
5,Nonarchimedean Function Algebraについて (Function Algebra),http://www.kurims.kyoto-u.ac.jp/~kyodo/kokyuroku/contents/pdf/0169-05.pdf,東京電機大学,鶴見 和之,"TSURUMI,KAZUYUKI"
6,極大イデアル空間のAnalytic Structure (Function Algebra),http://www.kurims.kyoto-u.ac.jp/~kyodo/kokyuroku/contents/pdf/0169-06.pdf,奈良教育大学,神保 敏弥,"JIMBO,TOSHIYA"
7,調和関数とベクトル束 (Function Algebra),http://www.kurims.kyoto-u.ac.jp/~kyodo/kokyuroku/contents/pdf/0169-07.pdf,電気通信大学,林 一道,"HAYASHI,KAZUMICHI"
8,$H^\infty(m)$の$w^*$ Maximalityについて (Function Algebra),http://www.kurims.kyoto-u.ac.jp/~kyodo/kokyuroku/contents/pdf/0169-08.pdf,和歌山大学教育学部,貴志 一男,"KISHI,KAZUO"
