No.,title,link,Affiliation,Author in JPN,Author in ENG
1,ALMOST DISJOINT AND INDEPENDENT FAMILIES (Aspects of Descriptive Set Theory),http://www.kurims.kyoto-u.ac.jp/~kyodo/kokyuroku/contents/pdf/1790-01.pdf,HAUSDORFF CENTER FOR MATHEMATICS,,"GESCHKE,STEFAN"
2,Notes on an old theorem of Erdos concerning CH (Aspects of Descriptive Set Theory),http://www.kurims.kyoto-u.ac.jp/~kyodo/kokyuroku/contents/pdf/1790-02.pdf,愛媛大学理工学研究院,藤田 博司,"Fujita,Hiroshi"
3,Descriptive set theory of complete quasi-metric spaces (Aspects of Descriptive Set Theory),http://www.kurims.kyoto-u.ac.jp/~kyodo/kokyuroku/contents/pdf/1790-03.pdf,情報通信研究機構,,"De Brecht,Matthew"
4,On reflection and non-reflection of countable list-chromatic number of graphs (Aspects of Descriptive Set Theory),http://www.kurims.kyoto-u.ac.jp/~kyodo/kokyuroku/contents/pdf/1790-04.pdf,"神戸大学大学院システム情報学研究科,神戸大学大学院システム情報学研究科","渕野 昌,酒井 拓史","Fuchino,Sakae,Sakai,Hiroshi"
5,VARIATIONS OF FODOR REFLECTION PRINCIPLES (Aspects of Descriptive Set Theory),http://www.kurims.kyoto-u.ac.jp/~kyodo/kokyuroku/contents/pdf/1790-05.pdf,,,"KONING,BERNHARD"
6,A Forcing Axiom and Chang's Conjecture (Aspects of Descriptive Set Theory),http://www.kurims.kyoto-u.ac.jp/~kyodo/kokyuroku/contents/pdf/1790-06.pdf,南山大学経営学部,宮元 忠敏,"MIYAMOTO,Tadatoshi"
7,NOTES ON MIYAMOTO'S FORCING AXIOMS (Aspects of Descriptive Set Theory),http://www.kurims.kyoto-u.ac.jp/~kyodo/kokyuroku/contents/pdf/1790-07.pdf,名古屋大学情報科学研究科,薄葉 季路,"USUBA,TOSHIMICHI"
8,UNPREPARED INDESTRUCTIBILITY (Aspects of Descriptive Set Theory),http://www.kurims.kyoto-u.ac.jp/~kyodo/kokyuroku/contents/pdf/1790-08.pdf,神戸大学システム情報学研究科,,"BROOKE-TAYLOR,ANDREW D."
9,SOME RESULTS IN THE EXTENSION WITH A COHERENT SUSLIN TREE (Aspects of Descriptive Set Theory),http://www.kurims.kyoto-u.ac.jp/~kyodo/kokyuroku/contents/pdf/1790-09.pdf,"神戸大学システム情報学研究科,静岡大学理学部","RAGHAVAN DILIP,依岡 輝幸","RAGHAVAN,DILIP,YORIOKA,TERUYUKI"
