No.,title,link,Affiliation,Author in JPN,Author in ENG
1,ハミルトン系の非可積分性の証明 (力学系の作る集団ダイナミクス : 保存系・散逸系の枠組みを越えて),http://www.kurims.kyoto-u.ac.jp/~kyodo/kokyuroku/contents/pdf/1827-01.pdf,大阪大学大学院基礎工学研究科,柴山 允瑠,"Shibayama,Mitsuru"
2,力学系・流体力学における計算トポロジー的手法について (力学系の作る集団ダイナミクス : 保存系・散逸系の枠組みを越えて),http://www.kurims.kyoto-u.ac.jp/~kyodo/kokyuroku/contents/pdf/1827-02.pdf,北海道大学大学院理学研究科・JST CREST,荒井 迅,"ARAI,Zin"
3,Random dynamics from time series (Collective Dynamics in Dynamical Systems : Across the border of preserving and dissipative systems),http://www.kurims.kyoto-u.ac.jp/~kyodo/kokyuroku/contents/pdf/1827-03.pdf,北海道大学電子科学研究所・理学院数学科,佐藤 譲,"Sato,Yuzuru"
4,大自由度散逸力学系における熱力学的分岐現象について (力学系の作る集団ダイナミクス : 保存系・散逸系の枠組みを越えて),http://www.kurims.kyoto-u.ac.jp/~kyodo/kokyuroku/contents/pdf/1827-04.pdf,大阪大学情報科学研究科,茶碗谷 毅,"Chawanya,Tsuyoshi"
5,大自由度保存力学系における集団的振動 (力学系の作る集団ダイナミクス : 保存系・散逸系の枠組みを越えて),http://www.kurims.kyoto-u.ac.jp/~kyodo/kokyuroku/contents/pdf/1827-05.pdf,JST-CREST・京都大学理学研究科数学教室,森田 英俊,"Morita,Hidetoshi"
6,結合振動子系の階層構造と集団位相記述 (力学系の作る集団ダイナミクス : 保存系・散逸系の枠組みを越えて),http://www.kurims.kyoto-u.ac.jp/~kyodo/kokyuroku/contents/pdf/1827-06.pdf,独立行政法人海洋研究開発機構,河村 洋史,"Kawamura,Yoji"
7,三体相互作用を持つ位相振動子ネットワークに生じる複数の「連続的」なアトラクタについて (力学系の作る集団ダイナミクス : 保存系・散逸系の枠組みを越えて),http://www.kurims.kyoto-u.ac.jp/~kyodo/kokyuroku/contents/pdf/1827-07.pdf,"京都大学情報学研究科・JST CREST,東京工業大学総合理工学研究科,京都大学情報学研究科・JST CREST","太田 絵一郎,田中 琢真,青柳 富誌生","Ota,Kaiichiro,Tanaka,Takuma,Aoyagi,Toshio"
8,一般化スペクトル理論と蔵本モデルのダイナミクス (力学系の作る集団ダイナミクス : 保存系・散逸系の枠組みを越えて),http://www.kurims.kyoto-u.ac.jp/~kyodo/kokyuroku/contents/pdf/1827-08.pdf,九州大学MI研究所,千葉 逸人,"CHIBA,Hayato"
9,空間1次元系における漸近減衰 (力学系の作る集団ダイナミクス : 保存系・散逸系の枠組みを越えて),http://www.kurims.kyoto-u.ac.jp/~kyodo/kokyuroku/contents/pdf/1827-09.pdf,京都大学大学院情報学研究科,山口 義幸,"Yamaguchi,Yoshiyuki Y."
10,空間非一様定常解周りの線形化Vlasov方程式 (力学系の作る集団ダイナミクス : 保存系・散逸系の枠組みを越えて),http://www.kurims.kyoto-u.ac.jp/~kyodo/kokyuroku/contents/pdf/1827-10.pdf,京都大学大学院情報学研究科数理工学専攻,小川 駿,"Ogawa,Shun"
11,Non-equilibrium Evolution of Long-range Interacting Systems and Polytrope (Collective Dynamics in Dynamical Systems : Across the border of preserving and dissipative systems),http://www.kurims.kyoto-u.ac.jp/~kyodo/kokyuroku/contents/pdf/1827-11.pdf,京都大学人間・環境学研究科,阪上 雅昭,"Sakagami,Masa-aki"
12,シェルモデル乱流に対する力学系解析 (力学系の作る集団ダイナミクス : 保存系・散逸系の枠組みを越えて),http://www.kurims.kyoto-u.ac.jp/~kyodo/kokyuroku/contents/pdf/1827-12.pdf,東北大学原子分子材料科学高等研究機構,小林 幹,"Kobayashi,Miki U."
13,大自由度力学系の有効次元と示量性 : Lyapunov解析によるアプローチ (力学系の作る集団ダイナミクス : 保存系・散逸系の枠組みを越えて),http://www.kurims.kyoto-u.ac.jp/~kyodo/kokyuroku/contents/pdf/1827-13.pdf,東京大学理学系研究科物理学専攻,竹内 一将,"Takeuchi,Kazumasa A."
14,ニューラルネットワークの入力による分岐構造と学習による変化 (力学系の作る集団ダイナミクス : 保存系・散逸系の枠組みを越えて),http://www.kurims.kyoto-u.ac.jp/~kyodo/kokyuroku/contents/pdf/1827-14.pdf,東京大学総合文化研究科,栗川 知己,"Kurikawa,Tomoki"
15,大自由度力学系の集団運動抽出に向けた問題提起 : 化学反応動力学の観点から (力学系の作る集団ダイナミクス : 保存系・散逸系の枠組みを越えて),http://www.kurims.kyoto-u.ac.jp/~kyodo/kokyuroku/contents/pdf/1827-15.pdf,"北海道大学電子科学研究所,奈良女子大学理学部,北海道大学電子科学研究所","寺本 央,戸田 幹人,小松崎 民樹","Teramoto,Hiroshi,Toda,Mikito,Komatsuzaki,Tamiki"
16,星の中の集団ダイナミクス : 磁場揺動・磁極反転・脈動・スケーリング・・・ (力学系の作る集団ダイナミクス : 保存系・散逸系の枠組みを越えて),http://www.kurims.kyoto-u.ac.jp/~kyodo/kokyuroku/contents/pdf/1827-16.pdf,お茶の水女子大学理学部,森川 雅博,"Morikawa,Masahiro"
17,量子力学系における集団運動 (力学系の作る集団ダイナミクス : 保存系・散逸系の枠組みを越えて),http://www.kurims.kyoto-u.ac.jp/~kyodo/kokyuroku/contents/pdf/1827-17.pdf,分子科学研究所・総合研究大学院大学,安池 智一,"Yasuike,Tomokazu"
18,階層ロジスティック方程式とその応用 : 普及率の動的挙動のメカニズム (力学系の作る集団ダイナミクス : 保存系・散逸系の枠組みを越えて),http://www.kurims.kyoto-u.ac.jp/~kyodo/kokyuroku/contents/pdf/1827-18.pdf,"お茶の水女子大学理学部物理学科,お茶の水女子大学理学部物理学科,お茶の水女子大学理学部物理学科","田代 徹,皆川 紘恵,千葉 路子","Tashiro,Tohru,Minagawa,Hiroe,Chiba,Michiko"
