No.,title,link,Affiliation,Author in JPN,Author in ENG
1,Definable slices in o-minimal structures (The Topology and the Algebraic Structures of Transformation Groups),http://www.kurims.kyoto-u.ac.jp/~kyodo/kokyuroku/contents/pdf/1922-01.pdf,和歌山大学教育学部,川上 智博,"Kawakami,Tomohiro"
2,On automorphism groups and plane models of Riemann surfaces (The Topology and the Algebraic Structures of Transformation Groups),http://www.kurims.kyoto-u.ac.jp/~kyodo/kokyuroku/contents/pdf/1922-02.pdf,工学院大学学習支援センター,春井 岳,"Harui,Takeshi"
3,On Alexander polynomials of some reduced curves (The Topology and the Algebraic Structures of Transformation Groups),http://www.kurims.kyoto-u.ac.jp/~kyodo/kokyuroku/contents/pdf/1922-03.pdf,東京理科大学理学部数学科,川島 正行,"Kawashima,Masayuki"
4,Spaces of equivariant maps to toric varieties (The Topology and the Algebraic Structures of Transformation Groups),http://www.kurims.kyoto-u.ac.jp/~kyodo/kokyuroku/contents/pdf/1922-04.pdf,電気通信大学情報理工学研究科,山口 耕平,"Yamaguchi,Kohhei"
5,"Nomizu, Hattori, Mostowの定理の発展 (変換群の位相幾何と代数構造)",http://www.kurims.kyoto-u.ac.jp/~kyodo/kokyuroku/contents/pdf/1922-05.pdf,東京工業大学大学院理工学研究科数学専攻,糟谷 久矢,"Kasuya,Hisashi"
6,グラフから定まる単体複体の位相について (変換群の位相幾何と代数構造),http://www.kurims.kyoto-u.ac.jp/~kyodo/kokyuroku/contents/pdf/1922-06.pdf,"大阪大学大学院理学研究科,洲本実業高等学校","原 靖浩,冨田 優次","Hara,Yasuhiro,Tomita,Yuji"
7,シュプリンガー多様体の$T^\ell$-同変コホモロジー環 (変換群の位相幾何と代数構造),http://www.kurims.kyoto-u.ac.jp/~kyodo/kokyuroku/contents/pdf/1922-07.pdf,"大阪市立大学数学研究所,大阪市立大学理学研究科","阿部 拓,堀口 達也","Abe,Hiraku,Horiguchi,Tatsuya"
8,COHOMOLOGY OF TORIC ORIGAMI MANIFOLDS (The Topology and the Algebraic Structures of Transformation Groups),http://www.kurims.kyoto-u.ac.jp/~kyodo/kokyuroku/contents/pdf/1922-08.pdf,大阪市立大学理学研究科,,"ZENG,HAOZHI"
9,ON $G$-BI-ISOVARIANT EQUIVALENCE BETWEEN $G$-REPRESENTATION SPACES (The Topology and the Algebraic Structures of Transformation Groups),http://www.kurims.kyoto-u.ac.jp/~kyodo/kokyuroku/contents/pdf/1922-09.pdf,"京都府立医科大学,京都産業大学理学部","長崎 生光,牛瀧 文宏","NAGASAKI,IKUMITSU,USHITAKI,FUMIHIRO"
10,Local and end deformation properties of uniform embeddings in $\kappa$-cones (The Topology and the Algebraic Structures of Transformation Groups),http://www.kurims.kyoto-u.ac.jp/~kyodo/kokyuroku/contents/pdf/1922-10.pdf,京都工芸繊維大学工芸科学研究科,矢ヶ崎 達彦,"Yagasaki,Tatsuhiko"
11,ルート系から定まるトーリック多様体上の交叉数とヤング図 (変換群の位相幾何と代数構造),http://www.kurims.kyoto-u.ac.jp/~kyodo/kokyuroku/contents/pdf/1922-11.pdf,大阪市立大学数学研究所,阿部 拓,"Abe,Hiraku"
12,LEFSCHETZ PENCILS AND FINITELY PRESENTED GROUPS (The Topology and the Algebraic Structures of Transformation Groups),http://www.kurims.kyoto-u.ac.jp/~kyodo/kokyuroku/contents/pdf/1922-12.pdf,"東京理科大学理工学部,大阪電気通信大学","小林 竜馬,門田 直之","KOBAYASHI,RYOMA,MONDEN,NAOYUKI"
13,グラフから構成されるスピントーリック多様体 (変換群の位相幾何と代数構造),http://www.kurims.kyoto-u.ac.jp/~kyodo/kokyuroku/contents/pdf/1922-13.pdf,大阪市立大学理学研究科,畑中 美帆,"Hatanaka,Miho"
14,コンパクトトーラスによる軌道空間が単純な多面体でないtoric manifoldの例 (変換群の位相幾何と代数構造),http://www.kurims.kyoto-u.ac.jp/~kyodo/kokyuroku/contents/pdf/1922-14.pdf,大阪市立大学大学院理学研究科数学教室,須山 雄介,"Suyama,Yusuke"
15,ANR空間からホモロジー球面への集合値写像の次数 (変換群の位相幾何と代数構造),http://www.kurims.kyoto-u.ac.jp/~kyodo/kokyuroku/contents/pdf/1922-15.pdf,明治大学政治経済学部,四反田 義美,"Shitanda,Yoshimi"
16,QUASITORIC MANIFOLDS WHICH ARE NOT TORIC ORIGAMI (The Topology and the Algebraic Structures of Transformation Groups),http://www.kurims.kyoto-u.ac.jp/~kyodo/kokyuroku/contents/pdf/1922-16.pdf,"大阪市立大学理学研究科,大阪市立大学理学研究科,DIVISION OF MATHEMATICAL MODELS, NATIONAL INSTITUTE FOR MATHEMATICAL SCIENCES,大阪市立大学理学研究科","AYZENBERG ANTON,枡田 幹也,PARK SEONJEONG,ZENG HAOZHI","AYZENBERG,ANTON,MASUDA,MIKIYA,PARK,SEONJEONG,ZENG,HAOZHI"
17,非有向曲面におけるデーン・ツィスト、ゴールドマン・リー代数とスケイン加群 (変換群の位相幾何と代数構造),http://www.kurims.kyoto-u.ac.jp/~kyodo/kokyuroku/contents/pdf/1922-17.pdf,東京大学数理科学研究科,辻 俊輔,"TSUJI,SHUNSUKE"
18,対角部分空間配置のホモトピー分解 (変換群の位相幾何と代数構造),http://www.kurims.kyoto-u.ac.jp/~kyodo/kokyuroku/contents/pdf/1922-18.pdf,京都大学理学研究科,岸本 大祐,"Kishimoto,Daisuke"
19,Classifications of homogeneous complexity one GKM manifolds and GKM graphs with symmetric group actions (The Topology and the Algebraic Structures of Transformation Groups),http://www.kurims.kyoto-u.ac.jp/~kyodo/kokyuroku/contents/pdf/1922-19.pdf,東京大学大学院数理科学研究科,黒木 慎太郎,"Kuroki,Shintaro"
20,GROUP ACTIONS ON COMPLEX PROJECTIVE SPACES VIA GROUP ACTIONS ON DISKS AND SPHERES (The Topology and the Algebraic Structures of Transformation Groups),http://www.kurims.kyoto-u.ac.jp/~kyodo/kokyuroku/contents/pdf/1922-20.pdf,"ADAM MICKIEWICZ UNIVERSITY IN POZNAN, FACULTY OF MATHEMATICS AND COMPUTER SCIENCE,ADAM MICKIEWICZ UNIVERSITY IN POZNAN, FACULTY OF MATHEMATICS AND COMPUTER SCIENCE",",","KALUBA,MAREK,PAWALOWSKI,KRZYSZTOF"
21,TENTATIVE STUDY ON EQUIVARIANT SURGERY OBSTRUCTIONS : FIXED POINT SETS OF SMOOTH $A_5$-ACTIONS (The Topology and the Algebraic Structures of Transformation Groups),http://www.kurims.kyoto-u.ac.jp/~kyodo/kokyuroku/contents/pdf/1922-21.pdf,岡山大学自然科学研究科,森本 雅治,"Morimoto,Masaharu"
22,ON EVALUATION FIBER SEQUENCES (The Topology and the Algebraic Structures of Transformation Groups),http://www.kurims.kyoto-u.ac.jp/~kyodo/kokyuroku/contents/pdf/1922-22.pdf,京都大学理学研究科,蔦谷 充伸,"TSUTAYA,MITSUNOBU"
23,COXETER群のホモロジーの$p$-PRIMARY COMPONENTについて (変換群の位相幾何と代数構造),http://www.kurims.kyoto-u.ac.jp/~kyodo/kokyuroku/contents/pdf/1922-23.pdf,北海道大学大学院理学研究院,秋田 利之,"Akita,Toshiyuki"
