No.,title,link,Affiliation,Author in JPN,Author in ENG
1,Local existence of solutions for the heat equation with a nonlinear boundary condition (Shapes and other properties of the solutions of PDEs),http://www.kurims.kyoto-u.ac.jp/~kyodo/kokyuroku/contents/pdf/1974-01.pdf,"東北大学大学院理学研究科,東北大学大学院理学研究科","石毛 和弘,佐藤 龍一","Ishige,Kazuhiro,Sato,Ryuichi"
2,Global existence and blow-up of solutions for a nonlinear heat equation with exponential nonlinearity (Shapes and other properties of the solutions of PDEs),http://www.kurims.kyoto-u.ac.jp/~kyodo/kokyuroku/contents/pdf/1974-02.pdf,大阪大学大学院基礎工学研究科,藤嶋 陽平,"Fujishima,Yohei"
3,Solutions to the equation of the scalar-field type on a large spherical cap (Shapes and other properties of the solutions of PDEs),http://www.kurims.kyoto-u.ac.jp/~kyodo/kokyuroku/contents/pdf/1974-03.pdf,大阪府立大学学術研究院数学系,壁谷 喜継,"Kabeya,Yoshitsugu"
4,Hadamard variational formula for the Stokes equations (Shapes and other properties of the solutions of PDEs),http://www.kurims.kyoto-u.ac.jp/~kyodo/kokyuroku/contents/pdf/1974-04.pdf,"北海道大学大学院理学研究科,玉川大学工学部","神保 秀一,牛越 惠理佳","Jimbo,Shuichi,Ushikoshi,Erika"
5,On the fine behaviors of the eigenvalues of the linearized Gel'fand problem and its applications (Shapes and other properties of the solutions of PDEs),http://www.kurims.kyoto-u.ac.jp/~kyodo/kokyuroku/contents/pdf/1974-05.pdf,金沢大学理工研究域,大塚 浩史,"Ohtsuka,Hiroshi"
6,On a Willmore-Helfrich $L^{2}$-flow of open curves in $\mathbb{R}^{n}$ : a different approach (Shapes and other properties of the solutions of PDEs),http://www.kurims.kyoto-u.ac.jp/~kyodo/kokyuroku/contents/pdf/1974-06.pdf,"Universitat Ulm,Universitat Duisburg-Essen, Mathematikcarree",",","Dall'Acqua,Anna,Pozzi,Paola"
7,Variational formulae and estimates for decomposed Mobius energies (Shapes and other properties of the solutions of PDEs),http://www.kurims.kyoto-u.ac.jp/~kyodo/kokyuroku/contents/pdf/1974-07.pdf,埼玉大学大学院理工学研究科,長澤 壯之,"Nagasawa,Takeyuki"
8,Switching Solutions of a Hybrid System describing Intermittent Androgen Suppression Therapy of Prostate Cancer (Shapes and other properties of the solutions of PDEs),http://www.kurims.kyoto-u.ac.jp/~kyodo/kokyuroku/contents/pdf/1974-08.pdf,東北大学大学院理学研究科,蛭子 くるみ,"Hiruko,Kurumi"
9,A FREE BOUNDARY PROBLEM FOR A TWO SPECIES SUPERIOR-INFERIOR COMPETITION-DIFFUSION MODEL (Shapes and other properties of the solutions of PDEs),http://www.kurims.kyoto-u.ac.jp/~kyodo/kokyuroku/contents/pdf/1974-09.pdf,"DEPARTMENT OF MATHEMATICS, TAMKANG UNIVERSITY",,"Guo,Jong-Shenq"
