No.,title,link,Affiliation,Author in JPN,Author in ENG
1,A multi-items closed supply chain with random demand and returned subassemblies (Theory and Its Application of Mathematical Models under Uncertainty),http://www.kurims.kyoto-u.ac.jp/~kyodo/kokyuroku/contents/pdf/2044-01.pdf,"大阪府立大学大学院理学系研究科情報数理科学専攻,大阪府立大学大学院工学研究科","山根 裕貴,北條 仁志","Yamane,Yuki,Hohjo,Hitoshi"
2,一定下落率を伴う双峰型関数上での二人タイミングゲーム (確率的環境下における数理モデルの理論と応用),http://www.kurims.kyoto-u.ac.jp/~kyodo/kokyuroku/contents/pdf/2044-02.pdf,大阪府立大学大学院工学研究科,北條 仁志,"Hohjo,Hitoshi"
3,レプリカ解析を用いた予算制約・集中投資度制約がある場合の最小投資リスクの理論解析 (確率的環境下における数理モデルの理論と応用),http://www.kurims.kyoto-u.ac.jp/~kyodo/kokyuroku/contents/pdf/2044-03.pdf,一橋大学森有礼高等教育国際流動化センター,新里 隆,"Shinzato,Takashi"
4,ランダム行列を用いた予算制約・集中投資度制約がある場合の最小投資リスクの理論評価 (確率的環境下における数理モデルの理論と応用),http://www.kurims.kyoto-u.ac.jp/~kyodo/kokyuroku/contents/pdf/2044-04.pdf,"首都大学東京大学院システムデザイン研究科,一橋大学森有礼高等教育国際流動化センター,首都大学東京大学院システムデザイン研究科,首都大学東京大学院システムデザイン研究科","多田 大智,新里 隆,肖 霄,山本 久志","Tada,Daichi,Shinzato,Takashi,Xiao,Xiao,Yamamoto,Hisashi"
5,回帰構造に基づくテスト環境を考慮した二項ソフトウェア信頼性モデルの拡張 (確率的環境下における数理モデルの理論と応用),http://www.kurims.kyoto-u.ac.jp/~kyodo/kokyuroku/contents/pdf/2044-05.pdf,"鳥取大学大学院工学研究科,鳥取大学大学院工学研究科","井上 真二,山田 茂","Inoue,Shinji,Yamada,Shigeru"
6,ディープラーニングに基づくソフトウェア故障発生時間間隔の推定法 (確率的環境下における数理モデルの理論と応用),http://www.kurims.kyoto-u.ac.jp/~kyodo/kokyuroku/contents/pdf/2044-06.pdf,"山口大学大学院創成科学研究科,山口大学大学院理工学研究科,鳥取大学大学院工学研究科,鳥取大学大学院工学研究科","田村 慶信,芦田 哲,松本 光穂,山田 茂","Tamura,Yoshinobu,Ashida,Satoshi,Matsumoto,Mitsuho,Yamada,Shigeru"
7,日本参議院の非対称パワー指数による分析 (確率的環境下における数理モデルの理論と応用),http://www.kurims.kyoto-u.ac.jp/~kyodo/kokyuroku/contents/pdf/2044-07.pdf,"芝浦工業大学大学院理工学研究科システム理工学専攻数理科学部門,芝浦工業大学システム理工学部数理科学科","武藤 央,穴太 克則","Muto,Hisashi,Ano,Katsunori"
8,Free Agent 投手獲得に対するポートフォリオ解析 (確率的環境下における数理モデルの理論と応用),http://www.kurims.kyoto-u.ac.jp/~kyodo/kokyuroku/contents/pdf/2044-08.pdf,"芝浦工業大学大学院理工学研究科システム理工学専攻数理科学部門,芝浦工業大学システム理工学部数理科学科","高野 健大,穴太 克則","Takano,Takehiro,Ano,Katsunori"
9,マルチレベル・モンテカルロ法による経路依存オプションの評価 (確率的環境下における数理モデルの理論と応用),http://www.kurims.kyoto-u.ac.jp/~kyodo/kokyuroku/contents/pdf/2044-09.pdf,"芝浦工業大学大学院理工学研究科システム理工学専攻数理科学部門,芝浦工業大学大学院理工学研究科システム理工学専攻数理科学部門,芝浦工業大学システム理工学部数理科学科","住本 賢吾,清水 雄斗,穴太 克則","Sumimoto,Kengo,Shimizu,Yuto,Ano,Katsunori"
10,一般化Ho-Leeモデルに基づくゲーム・フォワード・スワップションの価格評価 (確率的環境下における数理モデルの理論と応用),http://www.kurims.kyoto-u.ac.jp/~kyodo/kokyuroku/contents/pdf/2044-10.pdf,"SMBC日興証券株式会社リスク管理部,大阪大学大学院経済学研究科,大阪大学大学院経済学研究科・大阪大学数理・データ科学教育研究センター","蛯名 安希,落合 夏海,大西匡光","Ebina,Aki,Ochiai,Natsumi,Ohnishi,Masamitsu"
11,集合共有住宅の大規模修繕計画に関する経済性評価の不確実性 (確率的環境下における数理モデルの理論と応用),http://www.kurims.kyoto-u.ac.jp/~kyodo/kokyuroku/contents/pdf/2044-11.pdf,大阪工業大学情報センター,中西 真悟,"Nakanishi,Shingo"
12,セミフィボナッチ計画法 : 不等式アプローチ (確率的環境下における数理モデルの理論と応用),http://www.kurims.kyoto-u.ac.jp/~kyodo/kokyuroku/contents/pdf/2044-12.pdf,"九州大学,秋田県立大学","岩本 誠一,木村 寛","Iwamoto,Seiichi,Kimura,Yutaka"
13,ネットワーク上の損耗ゲームにおける勢力集中効果モデル (確率的環境下における数理モデルの理論と応用),http://www.kurims.kyoto-u.ac.jp/~kyodo/kokyuroku/contents/pdf/2044-13.pdf,防衛大学校,宝崎 隆祐,"Hohzaki,Ryusuke"
14,やや複雑なネットワーク上の探索問題の解析について (確率的環境下における数理モデルの理論と応用),http://www.kurims.kyoto-u.ac.jp/~kyodo/kokyuroku/contents/pdf/2044-14.pdf,兵庫県立大学経営学部,菊田 健作,"Kikuta,Kensaku"
15,On Three Topics of the Secretary Problem (Theory and Its Application of Mathematical Models under Uncertainty),http://www.kurims.kyoto-u.ac.jp/~kyodo/kokyuroku/contents/pdf/2044-15.pdf,愛知大学経営学部,玉置 光司,"Tamaki,Mitsushi"
16,集合値写像の連続性を用いた閉ファジィ集合と頑健的ファジィ集合の特徴付け (確率的環境下における数理モデルの理論と応用),http://www.kurims.kyoto-u.ac.jp/~kyodo/kokyuroku/contents/pdf/2044-16.pdf,弘前大学大学院理工学研究科,金 正道,"Kon,Masamichi"
17,適応型差分進化JADEにおける個体順位に基づくグループ別パラメータ制御 (確率的環境下における数理モデルの理論と応用),http://www.kurims.kyoto-u.ac.jp/~kyodo/kokyuroku/contents/pdf/2044-17.pdf,"広島修道大学商学部,広島市立大学大学院情報科学研究科","阪井 節子,高濱 徹行","Sakai,Setsuko,Takahama,Tetsuyuki"
18,プロジェクト・リスク・マネジメントにおける対策すべきリスクの選択について (確率的環境下における数理モデルの理論と応用),http://www.kurims.kyoto-u.ac.jp/~kyodo/kokyuroku/contents/pdf/2044-18.pdf,"金沢学院大学経営情報学部,金沢学院大学経営情報学部","福田 裕一,桑野 裕昭","Fukuda,Hirokatsu,Kuwano,Hiroaki"
19,折り紙ユニットで構成可能な凸多面体の合同判定 (確率的環境下における数理モデルの理論と応用),http://www.kurims.kyoto-u.ac.jp/~kyodo/kokyuroku/contents/pdf/2044-19.pdf,九州工業大学大学院工学研究院,藤田 敏治,"Fujita,Toshiharu"
20,二者択一の定理の折り紙への応用 (確率的環境下における数理モデルの理論と応用),http://www.kurims.kyoto-u.ac.jp/~kyodo/kokyuroku/contents/pdf/2044-20.pdf,九州大学大学院数理学研究院,川崎 英文,"Kawasaki,Hidefumi"
21,区間型マルコフ決定モデルについて (確率的環境下における数理モデルの理論と応用),http://www.kurims.kyoto-u.ac.jp/~kyodo/kokyuroku/contents/pdf/2044-21.pdf,神奈川大学理学部,堀口 正之,"Horiguchi,Masayuki"
22,確率的逐次割り当て問題について (確率的環境下における数理モデルの理論と応用),http://www.kurims.kyoto-u.ac.jp/~kyodo/kokyuroku/contents/pdf/2044-22.pdf,千葉大学教育学部,中井 達,"Nakai,Toru"
