No.,title,link,Affiliation,Author in JPN,Author in ENG
1,多様体学習とデータ空間の幾何学 (統計的モデリングと予測理論のための統合的数理研究),http://www.kurims.kyoto-u.ac.jp/~kyodo/kokyuroku/contents/pdf/2057-01.pdf,慶應義塾大学理工学部・JSTさきがけ,小林 景,"Kobayashi,Kei"
2,CGにおけるデータ駆動型モデリングと映像数理への期待 (統計的モデリングと予測理論のための統合的数理研究),http://www.kurims.kyoto-u.ac.jp/~kyodo/kokyuroku/contents/pdf/2057-02.pdf,東京工科大学メディア学部,藤堂 英樹,"Todo,Hideki"
3,クープマン作用素による非線形ダイナミクスの解析と電力・エネルギーシステムへの応用 (統計的モデリングと予測理論のための統合的数理研究),http://www.kurims.kyoto-u.ac.jp/~kyodo/kokyuroku/contents/pdf/2057-03.pdf,大阪府立大学工学研究科電気情報システム工学分野,薄 良彦,"Susuki,Yoshihiko"
4,生体計測工学と大自由度力学系のモデリング : 如何にして生命現象に迫るか (統計的モデリングと予測理論のための統合的数理研究),http://www.kurims.kyoto-u.ac.jp/~kyodo/kokyuroku/contents/pdf/2057-04.pdf,東京大学先端科学技術研究センター,小谷 潔,"Kotani,Kiyoshi"
5,位相的データ解析の現在 (統計的モデリングと予測理論のための統合的数理研究),http://www.kurims.kyoto-u.ac.jp/~kyodo/kokyuroku/contents/pdf/2057-05.pdf,東北大学原子分子材料科学高等研究機構,大林 一平,"Obayashi,Ippei"
6,Conley-Morseグラフの方法による時系列解析 (統計的モデリングと予測理論のための統合的数理研究),http://www.kurims.kyoto-u.ac.jp/~kyodo/kokyuroku/contents/pdf/2057-06.pdf,京都大学大学院理学研究科,森田 英俊,"Morita,Hidetoshi"
7,データ同化による不確かさを持つ現象の理解と予測ならびにモデリングへの展開 (統計的モデリングと予測理論のための統合的数理研究),http://www.kurims.kyoto-u.ac.jp/~kyodo/kokyuroku/contents/pdf/2057-07.pdf,明治大学総合数理学部,中村 和幸,"Nakamura,Kazuyuki"
8,統計的にセル・オートマトンをモデルする : その目的と実践 (統計的モデリングと予測理論のための統合的数理研究),http://www.kurims.kyoto-u.ac.jp/~kyodo/kokyuroku/contents/pdf/2057-08.pdf,"京都教育大学教育学部数学科,明治大学先端数理科学インスティテュート,JSTさきがけ・北海道大学大学院理学研究院数学部門","川原田 茜,宮路 智行,中野 直人","Kawaharada,Akane,Miyaji,Tomoyuki,Nakano,Naoto"
9,確率微分方程式と統計的モデル評価 (統計的モデリングと予測理論のための統合的数理研究),http://www.kurims.kyoto-u.ac.jp/~kyodo/kokyuroku/contents/pdf/2057-09.pdf,九州大学大学院数理学府,増田 弘毅,"Masuda,Hiroki"
