No.,title,link,Affiliation,Author in JPN,Author in ENG
1,二人零和ロバストゲームのNash均衡の存在性について (不確実性の下での意思決定の数理とその周辺),http://www.kurims.kyoto-u.ac.jp/~kyodo/kokyuroku/contents/pdf/2126-01.pdf,"秋田県立大学システム科学技術学部,秋田県立大学システム科学技術学部,秋田県立大学システム科学技術学部,秋田県立大学システム科学技術学部","齋藤 裕,加藤 志織,荒谷 洋輔,木村 寛","Saito,Yutaka,Kato,Shiori,Araya,Yousuke,Kimura,Yutaka"
2,サイバーセキュリティにおけるゲシュタルトナッシュ均衡の分析 (不確実性の下での意思決定の数理とその周辺),http://www.kurims.kyoto-u.ac.jp/~kyodo/kokyuroku/contents/pdf/2126-02.pdf,"大阪府立大学大学院工学研究科,大阪府立大学大学院工学研究科","兵藤 壮泰,北篠 仁志","Hyodo,Takeyasu,Hohjo,Hitoshi"
3,区間値距離を使用した階層的クラスタリングとその樹形図 (不確実性の下での意思決定の数理とその周辺),http://www.kurims.kyoto-u.ac.jp/~kyodo/kokyuroku/contents/pdf/2126-03.pdf,"首都大学東京都市環境学部,弘前大学大学院理工学研究科,弘前大学大学院理工学研究科","小笠原 悠,久野 優斗,金 正道","Ogasawara,Yu,Hisano,Yuto,Kon,Masamichi"
4,優加法性を仮定しない不完備情報協力ゲームのShapley値 (不確実性の下での意思決定の数理とその周辺),http://www.kurims.kyoto-u.ac.jp/~kyodo/kokyuroku/contents/pdf/2126-04.pdf,"Basque Country University,大東文化大学経営学部,Basque Country University","Albizuri M. Josune,桝屋 聡,Zarzuelo Jose M.","Albizuri,M. Josune,Masuya,Satoshi,Zarzuelo,Jose M."
5,非ゼロ和の施設警備ゲーム (不確実性の下での意思決定の数理とその周辺),http://www.kurims.kyoto-u.ac.jp/~kyodo/kokyuroku/contents/pdf/2126-05.pdf,防衛大学校情報工学科,宝崎 隆祐,"Hohzaki,Ryusuke"
6,A property of the undominated core for TU games (Mathematics of Decision Making under Uncertainty and Related Topics),http://www.kurims.kyoto-u.ac.jp/~kyodo/kokyuroku/contents/pdf/2126-06.pdf,兵庫県立大学経営学部,菊田 健作,"Kikuta,Kensaku"
7,集団的降下法に対するペナルティ係数の適応的調整法の提案 (不確実性の下での意思決定の数理とその周辺),http://www.kurims.kyoto-u.ac.jp/~kyodo/kokyuroku/contents/pdf/2126-07.pdf,"広島修道大学商学部,広島市立大学大学院情報科学研究科","阪井 節子,高濱 徹行","Sakai,Setsuko,Takahama,Tetsuyuki"
8,マルコフ決定過程による船の避難パターンを推定するモデル (不確実性の下での意思決定の数理とその周辺),http://www.kurims.kyoto-u.ac.jp/~kyodo/kokyuroku/contents/pdf/2126-08.pdf,"名古屋市立大学芸術工学部,名古屋市立大学芸術工学部,名古屋市立大学芸術工学部","王 埼,影山 正幸,張 景耀","Wang,Qi,Kageyama,Masayuki,Zhang,Jingyao"
9,区間型マルコフ決定過程の推移行列の推定について (不確実性の下での意思決定の数理とその周辺),http://www.kurims.kyoto-u.ac.jp/~kyodo/kokyuroku/contents/pdf/2126-09.pdf,神奈川大学理学部,堀口 正之,"HORIGUCHI,Masayuki"
10,Deegan-Packel指数に基づく非対称投票力指数の合理性と応用 (不確実性の下での意思決定の数理とその周辺),http://www.kurims.kyoto-u.ac.jp/~kyodo/kokyuroku/contents/pdf/2126-10.pdf,筑波技術大学保健科学部情報システム学科,鶴見 昌代,"TSURUMI,Masayo"
11,ファジィ集合最適化問題について (不確実性の下での意思決定の数理とその周辺),http://www.kurims.kyoto-u.ac.jp/~kyodo/kokyuroku/contents/pdf/2126-11.pdf,弘前大学大学院理工学研究科,金 正道,"KON,Masamichi"
12,ファジィ・プロジェクト・リスク管理モデル (不確実性の下での意思決定の数理とその周辺),http://www.kurims.kyoto-u.ac.jp/~kyodo/kokyuroku/contents/pdf/2126-12.pdf,金沢学院大学経営情報学部,桑野 裕昭,"Kuwano,Hiroaki"
13,ファジィ集合の比較と最適化に対する可能性理論的アプローチ (不確実性の下での意思決定の数理とその周辺),http://www.kurims.kyoto-u.ac.jp/~kyodo/kokyuroku/contents/pdf/2126-13.pdf,"新潟大学大学院自然科学研究科,新潟大学大学院自然科学研究科","池 浩一郎,田中 環","Ike,Koichiro,Tanaka,Tamaki"
14,折り紙ユニットによる凸多面体構成問題について - 実現可能な展開図の列挙 - (不確実性の下での意思決定の数理とその周辺),http://www.kurims.kyoto-u.ac.jp/~kyodo/kokyuroku/contents/pdf/2126-14.pdf,九州工業大学大学院工学研究院,藤田 敏治,"Fujita,Toshiharu"
15,混合単調性をもつ写像に対する不動点定理と混合単調性をもたない写像に対する不動点定理 (不確実性の下での意思決定の数理とその周辺),http://www.kurims.kyoto-u.ac.jp/~kyodo/kokyuroku/contents/pdf/2126-15.pdf,明治大学,渡辺 俊一,"WATANABE,TOSHIKAZU"
16,Spernerの補題に基づく離散不動点定理 (不確実性の下での意思決定の数理とその周辺),http://www.kurims.kyoto-u.ac.jp/~kyodo/kokyuroku/contents/pdf/2126-16.pdf,九州大学大学院数理学研究院,川崎 英文,"KAWASAKI,HIDEFUMI"
17,スタンバイ客を見込んだ多期間Littlewood の法則 (不確実性の下での意思決定の数理とその周辺),http://www.kurims.kyoto-u.ac.jp/~kyodo/kokyuroku/contents/pdf/2126-17.pdf,筑波大学,高木 英明,"Takagi,Hideaki"
18,Optimal Selection of the Penultimate Candidate (Mathematics of Decision Making under Uncertainty and Related Topics) ,http://www.kurims.kyoto-u.ac.jp/~kyodo/kokyuroku/contents/pdf/2126-18.pdf,愛知大学経営学部,玉置 光司,"Tamaki,Mitsushi"
19,外国為替レー卜を利用したインバウンド観光活用策 (不確実性の下での意思決定の数理とその周辺),http://www.kurims.kyoto-u.ac.jp/~kyodo/kokyuroku/contents/pdf/2126-19.pdf,愛知大学経営学部会計ファイナンス学科,齋藤 毅,"Saito,Tsuyoshi"
20,トレンド再生過程に基づく周期的取替え問題 (不確実性の下での意思決定の数理とその周辺),http://www.kurims.kyoto-u.ac.jp/~kyodo/kokyuroku/contents/pdf/2126-20.pdf,"海上保安大学校海上安全学講座,広島大学大学院工学研究科","齋藤 靖洋,土肥 正","Saito,Yasuhiro,Dohi,Tadashi"
21,ソフトウェア開発管理のためのCES型テスト時間関数に基づく2変量ソフトウェア信頼性モデル (不確実性の下での意思決定の数理とその周辺),http://www.kurims.kyoto-u.ac.jp/~kyodo/kokyuroku/contents/pdf/2126-21.pdf,"烏取大学大学院工学研究科,関西大学総合情報学部,烏取大学大学院工学研究科","南野 友香,井上 真二,山田 茂","Minamino,Yuka,Inoue,Shinji,Yamada,Shigeru"
22,OSSに対するジャンプ拡散過程モデルに基づく保守労力の最適化手法 (不確実性の下での意思決定の数理とその周辺),http://www.kurims.kyoto-u.ac.jp/~kyodo/kokyuroku/contents/pdf/2126-22.pdf,"東京都市大学知識工学部,東京都市大学総合理工学研究科,鳥取大学","田村 慶信,曽根 寛喜,山田 茂","Tamura,Yoshinobu,Sone,Hironobu,Yamada,Shigeru"
23,Semi-Sibonacci Programming - from Sibonacci to Silver -  (Mathematics of Decision Making under Uncertainty and Related Topics),http://www.kurims.kyoto-u.ac.jp/~kyodo/kokyuroku/contents/pdf/2126-23.pdf,"九州大学,秋田県立大学システム科学技術学部","岩本 誠一,木村 寛","Iwamoto,Seiichi,Kimura,Yutaka"
24,多目的計画問題の過小評価アプローチ (不確実性の下での意思決定の数理とその周辺),http://www.kurims.kyoto-u.ac.jp/~kyodo/kokyuroku/contents/pdf/2126-24.pdf,"秋田県立大学システム科学技術学部経営システム工学科,秋田県立大学システム科学技術学部経営システム工学科,秋田県立大学システム科学技術学部経営システム工学科,秋田県立大学システム科学技術学部経営システム工学科","荒谷 洋輔,鈴木 楓,齋藤 裕,木村寛","Araya,Yousuke,Suzuki,Kaede,Saito,Yutaka,Kimura,Yutaka"
