No.,title,link,Affiliation,Author in JPN,Author in ENG
1,乱流の分布汎函数方程式について (乱流の分布汎函数方程式の研究会報告集),http://www.kurims.kyoto-u.ac.jp/~kyodo/kokyuroku/contents/pdf/0023-01.pdf,京都大学理学部,池田 紀人,"IKEDA,NORITO"
2,無限次元ベクトル空間上の測度 (乱流の分布汎函数方程式の研究会報告集),http://www.kurims.kyoto-u.ac.jp/~kyodo/kokyuroku/contents/pdf/0023-02.pdf,京都大学数理解析研究所,山崎 泰郎,"YAMASAKI,YASUO"
3,Hopf方程式の直交函数展開による解法 (乱流の分布汎函数方程式の研究会報告集),http://www.kurims.kyoto-u.ac.jp/~kyodo/kokyuroku/contents/pdf/0023-03.pdf,東京大学宇宙航空研究所,桑原 真二,"KUWABARA,SHINJI"
4,統計流体カ学に於ける逐次近似解法 (乱流の分布汎函数方程式の研究会報告集),http://www.kurims.kyoto-u.ac.jp/~kyodo/kokyuroku/contents/pdf/0023-04.pdf,京都大学数理解析研究所,川原 琢治,"KAWAHARA,TAKUJI"
5,一次元プラズマの乱流 (乱流の分布汎函数方程式の研究会報告集),http://www.kurims.kyoto-u.ac.jp/~kyodo/kokyuroku/contents/pdf/0023-05.pdf,お茶女子大学理学部,岩田 義一,"IWATA,GIICHI"
6,VLASOV流体のエントロピーについて (乱流の分布汎函数方程式の研究会報告集),http://www.kurims.kyoto-u.ac.jp/~kyodo/kokyuroku/contents/pdf/0023-06.pdf,名古屋大学プラズマ研究所,中山 壽夫,"NAKAYAMA,TOSHIO"
