No.,title,link,Affiliation,Author in JPN,Author in ENG
1,Solenoids in Generic Hamiltonian Dynamics (常微分方程式の定性的研究),http://www.kurims.kyoto-u.ac.jp/~kyodo/kokyuroku/contents/pdf/0282-01.pdf,"Universities of Minnesota,University of Cincinnati",",","MARKUS,LAURENCE,MEYER,K."
2,A Categorical Consideration of Parallel Flows (常微分方程式の定性的研究),http://www.kurims.kyoto-u.ac.jp/~kyodo/kokyuroku/contents/pdf/0282-02.pdf,神戸大学教養部,江川 治朗,"EGAWA,JIRO"
3,On a Flow on the 3-Tours (常微分方程式の定性的研究),http://www.kurims.kyoto-u.ac.jp/~kyodo/kokyuroku/contents/pdf/0282-03.pdf,慶応義塾大学工学部,石井 一平,"ISHII,IPPEI"
4,Periodic Time Dependent Dynamical Systemについて (常微分方程式の定性的研究),http://www.kurims.kyoto-u.ac.jp/~kyodo/kokyuroku/contents/pdf/0282-04.pdf,名古屋大学教養部,池上 宜弘,"IKEGAMI,GIKO"
5,Boundedness and Convergence of Solutions of Duffing's Equation (常微分方程式の定性的研究),http://www.kurims.kyoto-u.ac.jp/~kyodo/kokyuroku/contents/pdf/0282-05.pdf,名古屋大学教養部,白岩 謙一,"SHIRAIWA,KENICHI"
6,Asymptotic Solutions of Certain Total Differential Equations (常微分方程式の定性的研究),http://www.kurims.kyoto-u.ac.jp/~kyodo/kokyuroku/contents/pdf/0282-06.pdf,神戸大学理学部,高野 恭一,"TAKANO,KYOICHI"
7,ある種の4階Fuchs型常微分方程式系のMonodromy群と既約性条件について (常微分方程式の定性的研究),http://www.kurims.kyoto-u.ac.jp/~kyodo/kokyuroku/contents/pdf/0282-07.pdf,東京都立大学理学部,佐々井 崇雄,"SASAI,TAKAO"
8,On Nagumo's Equation of a Neuron (常微分方程式の定性的研究),http://www.kurims.kyoto-u.ac.jp/~kyodo/kokyuroku/contents/pdf/0282-08.pdf,慶応義塾大学工学部,菊池 紀夫,"KIKUCHI,NORIO"
