No.,title,link,Affiliation,Author in JPN,Author in ENG
1,非線型制御の絶対安定性について (制御問題の数学的研究報告集),http://www.kurims.kyoto-u.ac.jp/~kyodo/kokyuroku/contents/pdf/0033-01.pdf,東北大学理学部,加藤 順二,"KATO,JUNJI"
2,非線形制御系の可制御性について (制御問題の数学的研究報告集),http://www.kurims.kyoto-u.ac.jp/~kyodo/kokyuroku/contents/pdf/0033-02.pdf,京都大学工学部,得丸 英勝,"TOKUMARU,HIDEKATSU"
3,On Linear Differential Games (制御問題の数学的研究報告集),http://www.kurims.kyoto-u.ac.jp/~kyodo/kokyuroku/contents/pdf/0033-03.pdf,大阪大学基礎工学部,坂和 愛幸,"SAKAWA,YOSHIYUKI"
4,差分微分方程式論における変分法の応用 (制御問題の数学的研究報告集),http://www.kurims.kyoto-u.ac.jp/~kyodo/kokyuroku/contents/pdf/0033-04.pdf,早稲田大学理工学部,杉山 昌平,"SUGIYAMA,SHOHEI"
5,偏微分方程式で表わされる系の最適制御 (制御問題の数学的研究報告集),http://www.kurims.kyoto-u.ac.jp/~kyodo/kokyuroku/contents/pdf/0033-05.pdf,東京大学工学部,有本 卓,"ARIMOTO,SUGURU"
6,バナッハ空間における最適制御問題 : バンバン制御に関する一つの考察 (制御問題の数学的研究報告集),http://www.kurims.kyoto-u.ac.jp/~kyodo/kokyuroku/contents/pdf/0033-06.pdf,東京大学理学部,増田 久弥,"MASUDA,KYUYA"
7,Probability Density Functionalの解析 : Noiseの分離 (制御問題の数学的研究報告集),http://www.kurims.kyoto-u.ac.jp/~kyodo/kokyuroku/contents/pdf/0033-07.pdf,大阪府立大学工学部,山縣 秀雄,"YAMAGATA,HIDEO"
8,動特性推定法の問題点 (制御問題の数学的研究報告集),http://www.kurims.kyoto-u.ac.jp/~kyodo/kokyuroku/contents/pdf/0033-08.pdf,東京大学工学部,茅 陽一,"KAYA,YOICHI"
