No.,title,link,Affiliation,Author in JPN,Author in ENG
1,PC Foliationについて (Topology of Foliations),http://www.kurims.kyoto-u.ac.jp/~kyodo/kokyuroku/contents/pdf/0347-01.pdf,京都大学理学部,足立 正久,"ADACHI,MASAHISA"
2,余次元1実解析的葉層構造のトポロジー (Topology of Foliations),http://www.kurims.kyoto-u.ac.jp/~kyodo/kokyuroku/contents/pdf/0347-02.pdf,東京大学理学部,稲葉 尚志,"INABA,TAKASHI"
3,複素解析的特異葉層構造 (Topology of Foliations),http://www.kurims.kyoto-u.ac.jp/~kyodo/kokyuroku/contents/pdf/0347-03.pdf,北海道大学教養部,諏訪 立雄,"SUWA,TATSUO"
4,$\Gamma$-葉層構造とtransverse projectable connectionsについて (Topology of Foliations),http://www.kurims.kyoto-u.ac.jp/~kyodo/kokyuroku/contents/pdf/0347-04.pdf,北海道大学理学部,鈴木 治夫,"SUZUKI,HARUO"
5,Null transversalをもたない余次元1葉層について (Topology of Foliations),http://www.kurims.kyoto-u.ac.jp/~kyodo/kokyuroku/contents/pdf/0347-05.pdf,京都大学教養部,今西 英器,"IMANISHI,HIDEKI"
6,余次元1葉層構造のSHR-分割とGodbillon-Vey類 (Topology of Foliations),http://www.kurims.kyoto-u.ac.jp/~kyodo/kokyuroku/contents/pdf/0347-06.pdf,東北大学理学部,西森 敏之,"NISHIMORI,TOSHIYUKI"
7,The Godbillon-Vey class of codimension one foliations without holonomy (Topology of Foliations),http://www.kurims.kyoto-u.ac.jp/~kyodo/kokyuroku/contents/pdf/0347-07.pdf,"東京大学教養学部,東京大学理学部","森田 茂之,坪井 俊","MORITA,SHIGEYUKI,TSUBOI,TAKASHI"
8,$T^2$上のfoliated S'-bundleによって代表されるBDiff$(S^1)$の2-cycleについて (Topology of Foliations),http://www.kurims.kyoto-u.ac.jp/~kyodo/kokyuroku/contents/pdf/0347-08.pdf,東京大学理学部,坪井 俊,"TSUBOI,TAKASHI"
9,振動しつつ成長する葉 (Topology of Foliations),http://www.kurims.kyoto-u.ac.jp/~kyodo/kokyuroku/contents/pdf/0347-09.pdf,東京大学理学部,土屋 信雄,"TSUCHIYA,NOBUO"
