No.,title,link,Affiliation,Author in JPN,Author in ENG
1,$C^*$-AlgebrasのRegular $\sigma$-Completionsについて (作用素環の研究とその応用),http://www.kurims.kyoto-u.ac.jp/~kyodo/kokyuroku/contents/pdf/0356-01.pdf,東北大学理学部,斎藤 和之,"SAITO,KAZUYUKI"
2,Group Duality and the Kubo-Martin-Schwinger Condition (作用素環の研究とその応用),http://www.kurims.kyoto-u.ac.jp/~kyodo/kokyuroku/contents/pdf/0356-02.pdf,",マルセイユ大学",",","MASAMICHI,TAKESAKI,KASTLER,DANIEL"
3,十分性、KMS条件及び相互情報量の作用素代数による研究 (作用素環の研究とその応用),http://www.kurims.kyoto-u.ac.jp/~kyodo/kokyuroku/contents/pdf/0356-03.pdf,東京理科大学,大矢 雅則,"OYA,MASANORI"
4,Derivations on Unbounded Operator Algebras (作用素環の研究とその応用),http://www.kurims.kyoto-u.ac.jp/~kyodo/kokyuroku/contents/pdf/0356-04.pdf,"福岡大学理学部,九州大学理学部","井上 淳,太田 昇一","INOUE,ATSUSHI,OTA,SHOICHI"
5,Ergodic変換のNormalizerのOuter Conjugacy (作用素環の研究とその応用),http://www.kurims.kyoto-u.ac.jp/~kyodo/kokyuroku/contents/pdf/0356-05.pdf,九州大学教養部,押川 元重,"OSHIKAWA,MOTOSHIGE"
6,$C^*$-環のフビニ積について (作用素環の研究とその応用),http://www.kurims.kyoto-u.ac.jp/~kyodo/kokyuroku/contents/pdf/0356-06.pdf,新潟大学教育学部,古谷 正,"FURUYA,TADASHI"
7,Towards a Spectral Theory on an Indefinite Inner Product Space (作用素環の研究とその応用),http://www.kurims.kyoto-u.ac.jp/~kyodo/kokyuroku/contents/pdf/0356-07.pdf,京都大学数理解析研究所,,"HANSEN,FRANK"
8,Inner Amenable GroupとGroup Operator Algebra (作用素環の研究とその応用),http://www.kurims.kyoto-u.ac.jp/~kyodo/kokyuroku/contents/pdf/0356-08.pdf,大阪教育大学,長田 まりゑ,"CHODA,MARIE"
