No.,title,link,Affiliation,Author in JPN,Author in ENG
1,Parameter Tuning and Repeated Application of the IMT-Type Transformation in Numerical Quadrature (Numerical Integration and Related Topics),http://www.kurims.kyoto-u.ac.jp/~kyodo/kokyuroku/contents/pdf/0401-01.pdf,"Department of Mathematical Engineering and Instrumentation Physics, Faculty of Engineering, University of Tokyo,Department of Mathematical Engineering and Instrumentation Physics, Faculty of Engineering, University of Tokyo",",","MUROTA,KAZUO,IRI,MASAO"
2,Notes on Effective Usage of Double Exponential Formulas for Numerical Integration (Numerical Integration and Related Topics),http://www.kurims.kyoto-u.ac.jp/~kyodo/kokyuroku/contents/pdf/0401-02.pdf,"Electrotechnical Laboratory,Nogei High School",",","TODA,HIDEO,ONO,HARUMI"
3,The Exact Degree of Precision of Generalized Gauss Kronrod (Numerical Integration and Related Topics),http://www.kurims.kyoto-u.ac.jp/~kyodo/kokyuroku/contents/pdf/0401-03.pdf,"Department of Applied Mathematics, The Weizmann Institute of Science",,"RABINOWITZ,PHILIP"
4,The Method of Splitting for Multidimensional Integration with Singularities (Numerical Integration and Related Topics),http://www.kurims.kyoto-u.ac.jp/~kyodo/kokyuroku/contents/pdf/0401-04.pdf,"Faculty of Engineering, Keio University",,"TAKAHASHI,HIDETOSHI"
5,Multiple Integration by a Modified Clenshaw-Curtis Quadrature Whose Number of Sample Points Is Increased with Arithmetic Progression (Numerical Integration and Related Topics),http://www.kurims.kyoto-u.ac.jp/~kyodo/kokyuroku/contents/pdf/0401-05.pdf,"Department of Information Science, Faculty of Engineering, Nagoya University,Department of Information Science, Faculty of Engineering, Nagoya University,Department of Information Science, Faculty of Engineering, Nagoya University",",,","HASEGAWA,TAKEMITSU,TORII,TATSUO,NINOMIYA,ICHIZO"
