No.,title,link,Affiliation,Author in JPN,Author in ENG
1,概均質べクトル空間に付随する多変数ゼータ函数 (概均質ベクトル空間の研究),http://www.kurims.kyoto-u.ac.jp/~kyodo/kokyuroku/contents/pdf/0416-01.pdf,立教大学理学部,佐藤 文広,"SATO,FUMIHIRO"
2,Simple Holonomic Systemの構造について (概均質ベクトル空間の研究),http://www.kurims.kyoto-u.ac.jp/~kyodo/kokyuroku/contents/pdf/0416-02.pdf,東京大学教養学部,大島 利雄,"OSHIMA,TOSHIO"
3,単純代数群の概均質ベクトル空間の分類 (概均質ベクトル空間の研究),http://www.kurims.kyoto-u.ac.jp/~kyodo/kokyuroku/contents/pdf/0416-03.pdf,筑波大学数学系,木村 達雄,"KIMURA,TATSUO"
4,Spin(10)×GL(3)に係わる既約概均質ベクトル空間のHolonomy Diagramとb-関数 (概均質ベクトル空間の研究),http://www.kurims.kyoto-u.ac.jp/~kyodo/kokyuroku/contents/pdf/0416-04.pdf,筑波大学付属盲学校,尾関 育三,"OZEKI,IKUZO"
5,"アフィンWeyl群の商空間 : 付録;$E_6,E_7$の不変式 (概均質ベクトル空間の研究)",http://www.kurims.kyoto-u.ac.jp/~kyodo/kokyuroku/contents/pdf/0416-05.pdf,埼玉大学理学部,矢野 環,"YANO,TAMAKI"
6,超函数の特異集合と概均質ベクトル空間に付随するゼータ函数の留数 (概均質ベクトル空間の研究),http://www.kurims.kyoto-u.ac.jp/~kyodo/kokyuroku/contents/pdf/0416-06.pdf,高知大学理学部,室 政和,"MURO,MASAKAZU"
