No.,title,link,Affiliation,Author in JPN,Author in ENG
1,"Equivariant Homotopy Groups, Power Operations and the Equivariant Kahn-Priddy Theorem (Topics in Homotopy Theory and Cohomology Theory)",http://www.kurims.kyoto-u.ac.jp/~kyodo/kokyuroku/contents/pdf/0419-01.pdf,大阪市立大学理学部,荒木 捷朗,"ARAKI,SHORO"
2,On Relations between the Brown-Peterson Cohomology Theory and the Ordinary Mod p Cohomology Theory (Topics in Homotopy Theory and Cohomology Theory),http://www.kurims.kyoto-u.ac.jp/~kyodo/kokyuroku/contents/pdf/0419-02.pdf,武蔵工業大学,柳田 伸顕,"YAGITA,NOBUAKI"
3,Unstable Cohomology Operations (Topics in Homotopy Theory and Cohomology Theory),http://www.kurims.kyoto-u.ac.jp/~kyodo/kokyuroku/contents/pdf/0419-03.pdf,John Hopkins Univ.,,"STEPHEN WILSON,W."
4,A Complement to the Theory of G-CW Complexes (Topics in Homotopy Theory and Cohomology Theory),http://www.kurims.kyoto-u.ac.jp/~kyodo/kokyuroku/contents/pdf/0419-04.pdf,広島大学理学部,松本 堯生,"MATSUMOTO,TAKAO"
5,J-Groups of Lens Spaces (Topics in Homotopy Theory and Cohomology Theory),http://www.kurims.kyoto-u.ac.jp/~kyodo/kokyuroku/contents/pdf/0419-05.pdf,広島大学理学部,藤井 憲三,"FUJII,KENSO"
6,On the $\beta$-Family in Stable Homotopy of Spheres at the Prime 3 (Topics in Homotopy Theory and Cohomology Theory),http://www.kurims.kyoto-u.ac.jp/~kyodo/kokyuroku/contents/pdf/0419-06.pdf,九州大学理学部,岡 七郎,"OKA,SHICHIRO"
7,On the Order of Certain Elements of J(X) and the Adams Conjecture (Topics in Homotopy Theory and Cohomology Theory),http://www.kurims.kyoto-u.ac.jp/~kyodo/kokyuroku/contents/pdf/0419-07.pdf,京都大学理学部,河野 明,"KONO,AKIRA"
8,On the Symplectic Lazard Ring (Topics in Homotopy Theory and Cohomology Theory),http://www.kurims.kyoto-u.ac.jp/~kyodo/kokyuroku/contents/pdf/0419-08.pdf,京都大学理学部,小島 一元,"KOJIMA,KAZUMOTO"
