No.,title,link,Affiliation,Author in JPN,Author in ENG
1,制御理論の最近の動向 (制御系方程式の研究報告集),http://www.kurims.kyoto-u.ac.jp/~kyodo/kokyuroku/contents/pdf/0045-01.pdf,京都大学工学部,椹木 義一,"SAWARAGI,YOSHIKAZU"
2,非線形計画と最適制御 (制御系方程式の研究報告集),http://www.kurims.kyoto-u.ac.jp/~kyodo/kokyuroku/contents/pdf/0045-02.pdf,"大阪大学基礎工学部,大阪大学基礎工学部","永久 洋治,坂和 愛幸","NAGAHISA,YOJI,SAKAWA,YOSHIYUKI"
3,On Finite Controllability of Second-Order Evolution Equations in Hilbert Spaces (制御系方程式の研究報告集),http://www.kurims.kyoto-u.ac.jp/~kyodo/kokyuroku/contents/pdf/0045-03.pdf,東京大学教養学部,辻岡 邦夫,"TSUJIOKA,KUNIO"
4,Non-Convex 0rientor Fieldについて (制御系方程式の研究報告集),http://www.kurims.kyoto-u.ac.jp/~kyodo/kokyuroku/contents/pdf/0045-04.pdf,神戸大学理学部,菊池 紀夫,"KIKUCHI,NORIO"
5,D.P.による最適制御 (制御系方程式の研究報告集),http://www.kurims.kyoto-u.ac.jp/~kyodo/kokyuroku/contents/pdf/0045-05.pdf,九州大学理学部,北川 敏男,"KITAGAWA,TOSHIO"
6,確率的系における最適制御過程について : 最終時刻が指定されない場合の最大原理 (制御系方程式の研究報告集),http://www.kurims.kyoto-u.ac.jp/~kyodo/kokyuroku/contents/pdf/0045-06.pdf,九州大学理学部,南 正義,"MINAMI,MASAYOSHI"
