No.,title,link,Affiliation,Author in JPN,Author in ENG
1,可約指数について : 鈴木氏の話へのIntroduction (Buchsbaum環とgeneralized Cohen-Macaulay環の研究),http://www.kurims.kyoto-u.ac.jp/~kyodo/kokyuroku/contents/pdf/0465-01.pdf,愛媛大学理学部,青山 陽一,"AOYAMA,YOICHI"
2,Index of Reducibility of Parameter Ideals of a Local Ring (II) (Buchsbaum環とgeneralized Cohen-Macaulay環の研究),http://www.kurims.kyoto-u.ac.jp/~kyodo/kokyuroku/contents/pdf/0465-02.pdf,"日本大学文理学部,静岡薬科大学","後藤 四郎,鈴木 直義","GOTO,SHIRO,SUZUKI,NAOYOSHI"
3,Noether一様連接環について (Buchsbaum環とgeneralized Cohen-Macaulay環の研究),http://www.kurims.kyoto-u.ac.jp/~kyodo/kokyuroku/contents/pdf/0465-03.pdf,日本大学文理学部,後藤 四郎,"GOTO,SHIRO"
4,Rees AlgebraのGorenstein性について (Buchsbaum環とgeneralized Cohen-Macaulay環の研究),http://www.kurims.kyoto-u.ac.jp/~kyodo/kokyuroku/contents/pdf/0465-04.pdf,名古屋大学理学部,池田 信,"IKEDA,SHIN"
5,Canonical Moduleについて (Buchsbaum環とgeneralized Cohen-Macaulay環の研究),http://www.kurims.kyoto-u.ac.jp/~kyodo/kokyuroku/contents/pdf/0465-05.pdf,愛媛大学理学部,青山 陽一,"AOYAMA,YOICHI"
6,Noether環はいつ忠実加群に埋蔵されるか (Buchsbaum環とgeneralized Cohen-Macaulay環の研究),http://www.kurims.kyoto-u.ac.jp/~kyodo/kokyuroku/contents/pdf/0465-06.pdf,東京理科大学大学院,山岸 規久道,"YAMAGISHI,KIKUMICHI"
7,次数付きNoether環の有限生成性について (Buchsbaum環とgeneralized Cohen-Macaulay環の研究),http://www.kurims.kyoto-u.ac.jp/~kyodo/kokyuroku/contents/pdf/0465-07.pdf,"日本大学文理学部,東京理科大学","後藤 四郎,山岸 規久道","GOTO,SHIRO,YAMAGISHI,KIKUMICHI"
8,完全交叉環におけるZariski-Lipmanの予想について (Buchsbaum環とgeneralized Cohen-Macaulay環の研究),http://www.kurims.kyoto-u.ac.jp/~kyodo/kokyuroku/contents/pdf/0465-08.pdf,名古屋大学理学部,吉野 雄二,"YOSHINO,YUJI"
9,ASL(Algebras with Straightening Laws)に関するいくつかの結果 (Buchsbaum環とgeneralized Cohen-Macaulay環の研究),http://www.kurims.kyoto-u.ac.jp/~kyodo/kokyuroku/contents/pdf/0465-09.pdf,名古屋工業大学,渡辺 敬一,"WATANABE,KEIICHI"
