No.,title,link,Affiliation,Author in JPN,Author in ENG
1,Any Hermitian Matrix is a Linear Combination of Four Projections,http://www.kurims.kyoto-u.ac.jp/~kyodo/kokyuroku/contents/pdf/0500-01.pdf,北海道大学応用電気研究所,中村 美浩,"Nakamura, Yoshihiro"
2,B(H)上のHermite元について(作用素の不等式とその周辺),http://www.kurims.kyoto-u.ac.jp/~kyodo/kokyuroku/contents/pdf/0500-02.pdf,布施高等学校,加藤 佳宣,"Kato, Yoshinobu"
3,C$^\ast$-algebraのstateの間のtransition probability(作用素の不等式とその周辺),http://www.kurims.kyoto-u.ac.jp/~kyodo/kokyuroku/contents/pdf/0500-03.pdf,北海道大学応用電気研究所,安藤 毅,"Ando, Tsuyoshi"
4,Transcendental radius and Mirsky functional,http://www.kurims.kyoto-u.ac.jp/~kyodo/kokyuroku/contents/pdf/0500-04.pdf,大阪教育大学,藤井 正俊,"FUJII, Masatoshi"
5,Intertwining operators の間の spectrum の関係について(作用素の不等式とその周辺),http://www.kurims.kyoto-u.ac.jp/~kyodo/kokyuroku/contents/pdf/0500-05.pdf,東北大学教養学部,吉野 崇,"Yoshino, Takashi"
6,Majorization と doubly stochastic map について(作用素の不等式とその周辺),http://www.kurims.kyoto-u.ac.jp/~kyodo/kokyuroku/contents/pdf/0500-06.pdf,大阪府立桃谷高等学校,,亀井 栄三郎
7,作用素平均に関連した不等式について(作用素の不等式とその周辺),http://www.kurims.kyoto-u.ac.jp/~kyodo/kokyuroku/contents/pdf/0500-07.pdf,富山大学理学部,久保 文夫,"Kubo, Fumio"
8,可逆作用素の集合の構造について(作用素の不等式とその周辺),http://www.kurims.kyoto-u.ac.jp/~kyodo/kokyuroku/contents/pdf/0500-08.pdf,富山大学教育学部,泉野 佐一,"Izumino, Saichi"
