No.,title,link,Affiliation,Author in JPN,Author in ENG
1,MOVABILITY IN FIBER SHAPE THEORY(STUDIES ON CONTINUA AND INFINITE-DIMENSIONAL MANIFOLDS),http://www.kurims.kyoto-u.ac.jp/~kyodo/kokyuroku/contents/pdf/0509-01.pdf,University of Tsukuba,矢ヶ崎 達彦,"Yagasaki, Tatsuhiko"
2,HYPERSPACES AND WHITNEY MAPS(STUDIES ON CONTINUA AND INFINITE-DIMENSIONAL MANIFOLDS),http://www.kurims.kyoto-u.ac.jp/~kyodo/kokyuroku/contents/pdf/0509-02.pdf,筑波大学,加藤 久男,"Kato, Hisao"
3,REFINABLE MAPS AND SHAPE(STUDIES ON CONTINUA AND INFINITE-DIMENSIONAL MANIFOLDS),http://www.kurims.kyoto-u.ac.jp/~kyodo/kokyuroku/contents/pdf/0509-03.pdf,筑波大学数学系,加藤 久男,"Kato, Hisao"
4,On a generalization of homotopy groups(STUDIES ON CONTINUA AND INFINITE-DIMENSIONAL MANIFOLDS),http://www.kurims.kyoto-u.ac.jp/~kyodo/kokyuroku/contents/pdf/0509-04.pdf,山口大学,渡辺 正,"Watanabe, Tadashi"
5,The Fixed Point Property for Continua with Finitely Many Arc Components(STUDIES ON CONTINUA AND INFINITE-DIMENSIONAL MANIFOLDS),http://www.kurims.kyoto-u.ac.jp/~kyodo/kokyuroku/contents/pdf/0509-05.pdf,"Faculty of Integrated Arts and Sciences, Hiroshima University",冨永 晃,"TOMINAGA, Akira"
6,Aposyndesis and cut points which are related to refinable maps(STUDIES ON CONTINUA AND INFINITE-DIMENSIONAL MANIFOLDS),http://www.kurims.kyoto-u.ac.jp/~kyodo/kokyuroku/contents/pdf/0509-06.pdf,"Department of Mathematics, Tokyo Gakugei Univ.",細川 洋,"Hosokawa, Hiroshi"
7,Manifolds Modeled on the Direct Limits of Euclidian Spaces and Hilbert cubes : A Survey(STUDIES ON CONTINUA AND INFINITE-DIMENSIONAL MANIFOLDS),http://www.kurims.kyoto-u.ac.jp/~kyodo/kokyuroku/contents/pdf/0509-07.pdf,"Institute of Mathematics, University of Tsukuba",酒井 克郎,"Sakai, Katsuro"
8,Infinite Dimensional Combinatorial Topology(STUDIES ON CONTINUA AND INFINITE-DIMENSIONAL MANIFOLDS),http://www.kurims.kyoto-u.ac.jp/~kyodo/kokyuroku/contents/pdf/0509-08.pdf,"Institute of Mathematics, University of Tsukuba",酒井 克郎,"Sakai, Katsuro"
9,Homology theories on strong shape(STUDIES ON CONTINUA AND INFINITE-DIMENSIONAL MANIFOLDS),http://www.kurims.kyoto-u.ac.jp/~kyodo/kokyuroku/contents/pdf/0509-09.pdf,大阪教育大学,小山 晃,"Koyama, Akira"
