No.,title,link,Affiliation,Author in JPN,Author in ENG
1,経験分布関数に基いた適合度検定統計量の漸近的性質について(統計的推定論の研究),http://www.kurims.kyoto-u.ac.jp/~kyodo/kokyuroku/contents/pdf/0623-01.pdf,統計数理研究所,安芸 重雄,"Aki, Sigeo"
2,フィードバックをもつガウス型通信路容量(統計的推定論の研究),http://www.kurims.kyoto-u.ac.jp/~kyodo/kokyuroku/contents/pdf/0623-02.pdf,東京大学工学部,公文 雅之,"Kumon, Masayuki"
3,Asymptotic properties of sequential density estimation,http://www.kurims.kyoto-u.ac.jp/~kyodo/kokyuroku/contents/pdf/0623-03.pdf,新潟大学理学部,磯貝 英一,"Isogai, Eiichi"
4,Amount of Information in Non-Regular Estimation,http://www.kurims.kyoto-u.ac.jp/~kyodo/kokyuroku/contents/pdf/0623-04.pdf,,赤平 昌文,"Akahira, Masafumi"
5,セパレート推測と情報量(統計的推定論の研究),http://www.kurims.kyoto-u.ac.jp/~kyodo/kokyuroku/contents/pdf/0623-05.pdf,統計数理研究所,久保木 久孝,"KUBOKI, Hisataka"
6,変換群を持つ統計モデルの幾何学(統計的推定論の研究),http://www.kurims.kyoto-u.ac.jp/~kyodo/kokyuroku/contents/pdf/0623-06.pdf,"東京大学工学部,東京大学工学部","甘利 俊一,倉田 耕治","Amari, Shun-ichi,Kurata, Koji"
7,Contrast from one probability measure to another : the associated geometry,http://www.kurims.kyoto-u.ac.jp/~kyodo/kokyuroku/contents/pdf/0623-07.pdf,広島大学理学部,江口 真透,"Eguchi, Shinto"
8,対数正規分布と一般対数正規分布 : 諸性質と母数推定(統計的推定論の研究),http://www.kurims.kyoto-u.ac.jp/~kyodo/kokyuroku/contents/pdf/0623-08.pdf,東京理科大学理工学部,清水 邦夫,"Shimizu, Kunio"
