No.,title,link,Affiliation,Author in JPN,Author in ENG
1,Notes on cohomological dimension modulo p : nonmetrizable version,http://www.kurims.kyoto-u.ac.jp/~kyodo/kokyuroku/contents/pdf/0659-01.pdf,"大阪教育大学数理科学研究科,山口大学教育学部","小山 晃,渡辺 正","Koyama, A.,Watanabe, T."
2,無限次元トポロジーにおける写像空間に関する問題(Shape理論及びGeometric Topologyの研究),http://www.kurims.kyoto-u.ac.jp/~kyodo/kokyuroku/contents/pdf/0659-02.pdf,筑波大学数学系,酒井 克郎,"Sakai, Katsuro"
3,Homogeneous space について(Shape理論及びGeometric Topologyの研究),http://www.kurims.kyoto-u.ac.jp/~kyodo/kokyuroku/contents/pdf/0659-03.pdf,筑波大学数学系,川村 一宏,"Kawamura, Kazuhiro"
4,From the Topics of Fractal Geometry,http://www.kurims.kyoto-u.ac.jp/~kyodo/kokyuroku/contents/pdf/0659-04.pdf,"Department of Mathematics, Faculty of Education, Kagawa University",深石 博夫,"Fukaishi, Hiroo"
5,写像の Leray スペクトル列と fiber shape(Shape理論及びGeometric Topologyの研究),http://www.kurims.kyoto-u.ac.jp/~kyodo/kokyuroku/contents/pdf/0659-05.pdf,筑波大学数学系,矢ヶ崎 達彦,"Yagasaki, Tatsuhiko"
