No.,title,link,Affiliation,Author in JPN,Author in ENG
1,混合流体の対流不安定とカオス(乱れの3次元化とカオス),http://www.kurims.kyoto-u.ac.jp/~kyodo/kokyuroku/contents/pdf/0665-01.pdf,岡山大学工学部,柳瀬 真一郎,"Yanase, Shinichiro"
2,カオスの局在化 : 特にSpatio Temporal intermittency について(乱れの3次元化とカオス),http://www.kurims.kyoto-u.ac.jp/~kyodo/kokyuroku/contents/pdf/0665-02.pdf,京都大学理学部物理学科,藤 定義,"Toh, Sadayoshi"
3,ナビエストークス流のカオス化(乱れの3次元化とカオス),http://www.kurims.kyoto-u.ac.jp/~kyodo/kokyuroku/contents/pdf/0665-03.pdf,"京都大学数理解析研究所,京都大学防災研究所,京都大学理学部物理学科","木田 重雄,山田 道夫,大木谷 耕司","Kida, Shigeo,Yamada, Michio,Ohkitani, Koji"
4,絶対不安定と移流不安定(乱れの3次元化とカオス),http://www.kurims.kyoto-u.ac.jp/~kyodo/kokyuroku/contents/pdf/0665-04.pdf,京都大学防災研究所,山田 道夫,"Yamada, Michio"
5,鉛直流体層の自然対流における撹乱の共鳴(乱れの3次元化とカオス),http://www.kurims.kyoto-u.ac.jp/~kyodo/kokyuroku/contents/pdf/0665-05.pdf,UCLA,藤村 薫,"FUJIMURA, Kaoru"
6,鉛直流体層における熱対流の実験(乱れの3次元化とカオス),http://www.kurims.kyoto-u.ac.jp/~kyodo/kokyuroku/contents/pdf/0665-06.pdf,大阪府立大学工学部,脇谷 俊一,"Wakitani, Shunichi"
7,乱流遷移を支配する不規則変動の成長過程(乱れの3次元化とカオス),http://www.kurims.kyoto-u.ac.jp/~kyodo/kokyuroku/contents/pdf/0665-07.pdf,"大阪府立大学工学部,大阪府立大学工学部,大阪府立大学大学院","西岡 通男,浅井 雅人,鈴木 和彦","Nishioka, Michio,Asai, Masahito,Suzuki, Kazuhiko"
8,乱流遷移を支配する三次元撹乱の発生過程(乱れの3次元化とカオス),http://www.kurims.kyoto-u.ac.jp/~kyodo/kokyuroku/contents/pdf/0665-08.pdf,"大阪府立大学工学部,大阪府立大学工学部","浅井 雅人,西岡 通男","Asai, Masahito,Nishioka, Michio"
