No.,title,link,Affiliation,Author in JPN,Author in ENG
1,非定常な推移確率分布をもつマルコフ決定過程 (動的計画法の研究会報告集),http://www.kurims.kyoto-u.ac.jp/~kyodo/kokyuroku/contents/pdf/0067-01.pdf,九州大学理学部,古川 長太,"FURUKAWA,NAGATA"
2,離散時間マルコフ系における最大原理について (動的計画法の研究会報告集),http://www.kurims.kyoto-u.ac.jp/~kyodo/kokyuroku/contents/pdf/0067-02.pdf,九州大学理学部,古川 長太,"FURUKAWA,NAGATA"
3,確率的系における最適制御過程について : 最適制御の存在性 (動的計画法の研究会報告集),http://www.kurims.kyoto-u.ac.jp/~kyodo/kokyuroku/contents/pdf/0067-03.pdf,九州大学理学部,南 正義,"MINAMI,MASAYOSHI"
4,Mathematical Models of Neuronal Spike Activities (動的計画法の研究会報告集),http://www.kurims.kyoto-u.ac.jp/~kyodo/kokyuroku/contents/pdf/0067-04.pdf,鹿児島大学理学部,加納 省吾,"KANO,SEIGO"
5,連立型関数方程式におけるリプシツ定数の評価について (動的計画法の研究会報告集),http://www.kurims.kyoto-u.ac.jp/~kyodo/kokyuroku/contents/pdf/0067-05.pdf,慶応義塾大学工学部管理工学科,柳井 浩,"YANAI,HIROSHI"
6,或る種の配分過程 (動的計画法の研究会報告集),http://www.kurims.kyoto-u.ac.jp/~kyodo/kokyuroku/contents/pdf/0067-06.pdf,九州大学理学部,北川 敏男,"KITAGAWA,TOSHIO"
