No.,title,link,Affiliation,Author in JPN,Author in ENG
1,Initial Literal Shuffles(Algebraic Theory of Codes and Related Topics),http://www.kurims.kyoto-u.ac.jp/~kyodo/kokyuroku/contents/pdf/0697-01.pdf,"京都産業大学理学部,広島修道大学商学部",",","伊藤 正美,田中 源次郎"
2,Free Regular Bands and Free Regular $^\ast$-Bands(Algebraic Theory of Codes and Related Topics),http://www.kurims.kyoto-u.ac.jp/~kyodo/kokyuroku/contents/pdf/0697-02.pdf,立命館大学理工学部,中嶋 史図雄,"Nakajima, Sizuo"
3,Maximal avoidable sets of words(Algebraic Theory of Codes and Related Topics),http://www.kurims.kyoto-u.ac.jp/~kyodo/kokyuroku/contents/pdf/0697-03.pdf,徳島大学総合科学部,小林 ユウ治,"Kobayashi, Yuji"
4,Arcs and Steiner triple systems(Algebraic Theory of Codes and Related Topics),http://www.kurims.kyoto-u.ac.jp/~kyodo/kokyuroku/contents/pdf/0697-04.pdf,岡山大学理学部,丸田 辰哉,"Maruta, Tatsuya"
5,$p$-Discrete Languages(Algebraic Theory of Codes and Related Topics),http://www.kurims.kyoto-u.ac.jp/~kyodo/kokyuroku/contents/pdf/0697-05.pdf,"Department of Mathematics, The University of Western Ontario,Department of Mathematics, The University of Western Ontario,Department of Mathematics, The University of Western Ontario",",,","Shyr, H.J.,Thierrin, G.,Yu, S.S."
6,Some Algebraic Properties of Comma-Free Codes(Algebraic Theory of Codes and Related Topics),http://www.kurims.kyoto-u.ac.jp/~kyodo/kokyuroku/contents/pdf/0697-06.pdf,"Institute of Applied Mathematics, National Chung-Hsing University,Institute of Applied Mathematics, National Chung-Hsing University,Institute of Applied Mathematics, National Chung-Hsing University",",,","Hsieh, C.Y.,Hsu, S.C.,Shyr, H.J."
7,Context-free Languages in $X^+ \backslash Q$(Algebraic Theory of Codes and Related Topics),http://www.kurims.kyoto-u.ac.jp/~kyodo/kokyuroku/contents/pdf/0697-07.pdf,"京都産業大学理学部,京都産業大学理学部",",","伊藤 正美,勝良 昌司"
8,biprefix codeの1つの族について(代数的コード理論と関連分野),http://www.kurims.kyoto-u.ac.jp/~kyodo/kokyuroku/contents/pdf/0697-08.pdf,東海大学短期大学部,中畑 登,"Nakahata, Noboru"
9,Strongly compatible total orders on free monoids(Algebraic Theory of Codes and Related Topics),http://www.kurims.kyoto-u.ac.jp/~kyodo/kokyuroku/contents/pdf/0697-09.pdf,"下関水産大学教養学部,宇部工業高等専門学校,徳島大学総合科学部",",,","斎藤 立彦,岩本 徳郎,小林 ユウ治[他]"
