No.,title,link,Affiliation,Author in JPN,Author in ENG
1,一般曲線座標系による室内気流数値シミュレーション(第2回先端技術における数理科学的諸問題の解明),http://www.kurims.kyoto-u.ac.jp/~kyodo/kokyuroku/contents/pdf/0736-01.pdf,"東京大学生産技術研究所,東京大学生産技術研究所,鹿島建設株式会社","村上 周三,加藤 信介,庄子 幹雄[他]","Murakami, Shuzo,Kato, Shinsuke,Shoji, Mikio"
2,スーパーコンピュータの動向と今後の展望(第2回先端技術における数理科学的諸問題の解明),http://www.kurims.kyoto-u.ac.jp/~kyodo/kokyuroku/contents/pdf/0736-02.pdf,日立中央研究所,長島 重夫,"Nagashima, Shigeo"
3,Robustness Issues of Learning Control for Robotic Motions,http://www.kurims.kyoto-u.ac.jp/~kyodo/kokyuroku/contents/pdf/0736-03.pdf,"Department of Mathematical Engineering and Information Physics, Faculty of Engineering, University of Tokyo",,"Arimoto, Suguru"
4,移流拡散方程式の対称有限要素近似とURR(第2回先端技術における数理科学的諸問題の解明),http://www.kurims.kyoto-u.ac.jp/~kyodo/kokyuroku/contents/pdf/0736-04.pdf,"電気通信大学,電気通信大学大学院,電気通信大学","田端 正久,尾関 義一,浜田 穂積","Tabata, Masahisa,Ozeki, Yoshiichi,Hamada, Hozumi"
5,有限要素法の事後誤差評価法(第2回先端技術における数理科学的諸問題の解明),http://www.kurims.kyoto-u.ac.jp/~kyodo/kokyuroku/contents/pdf/0736-05.pdf,三菱重工業株式会社システム技術部,馬場 金司,"Baba, Kinji"
6,三菱化成(株)総合研究所に於ける計算機科学の展開(第2回先端技術における数理科学的諸問題の解明),http://www.kurims.kyoto-u.ac.jp/~kyodo/kokyuroku/contents/pdf/0736-06.pdf,三菱化成(株)総合研究所,,影山 博徳
7,胃粘膜分光反射率測定と内視鏡画像の色再現シミュレーション(第2回先端技術における数理科学的諸問題の解明),http://www.kurims.kyoto-u.ac.jp/~kyodo/kokyuroku/contents/pdf/0736-07.pdf,"千葉大学大学院自然科学研究科,千葉大学大学院自然科学研究科,オリンパス光学工業株式会社","関谷 尊臣,三宅 洋一,原 忠義","Sekiya, Takaomi,Miyake, Yoichi,Hara, Tadayoshi"
8,制約条件付きの構造形態解析(第2回先端技術における数理科学的諸問題の解明),http://www.kurims.kyoto-u.ac.jp/~kyodo/kokyuroku/contents/pdf/0736-08.pdf,東京大学生産技術研究所,半谷 裕彦,"Hangai, Yasuhiko"
