No.,title,link,Affiliation,Author in JPN,Author in ENG
1,On the large time behavior of solutions for some degenerate quasilinear parabolic systems,http://www.kurims.kyoto-u.ac.jp/~kyodo/kokyuroku/contents/pdf/0795-01.pdf,福岡大学理学部,仙葉 隆,"Semba, Takasi"
2,小さな非線型境界条件をもつ反応拡散方程式に対するinertial manifoldの存在と応用(偏微分方程式の解の構造の研究),http://www.kurims.kyoto-u.ac.jp/~kyodo/kokyuroku/contents/pdf/0795-02.pdf,"龍谷大学理工学部,京都大学理学部,東京工業大学理学部","森田 善久,二宮 広和,柳田 英二","Morita, Yoshihisa,Ninomiya, Hirokazu,Yanagida, Eiji"
3,台がコンパクトでない初期dataをもつ半線型波動方程式の大域解の存在について(偏微分方程式の解の構造の研究),http://www.kurims.kyoto-u.ac.jp/~kyodo/kokyuroku/contents/pdf/0795-03.pdf,"北海道大学理学部,早稲田大学理工学部","久保田 幸次,津田谷 公利","Kubota, Koji,Tsutaya, Kimitoshi"
4,ある微分作用素の準楕円性と厳準楕円性について(偏微分方程式の解の構造の研究),http://www.kurims.kyoto-u.ac.jp/~kyodo/kokyuroku/contents/pdf/0795-04.pdf,大阪大学理学部,森岡 達史,"Morioka, Tatsushi"
5,半線形実主要型方程式系に対するpolarization setの伝播(偏微分方程式の解の構造の研究),http://www.kurims.kyoto-u.ac.jp/~kyodo/kokyuroku/contents/pdf/0795-05.pdf,京都大学理学部,土居 伸一,"Doi, Shin-ichi"
6,抽象的Besov空間とその応用(偏微分方程式の解の構造の研究),http://www.kurims.kyoto-u.ac.jp/~kyodo/kokyuroku/contents/pdf/0795-06.pdf,筑波大学数学系,村松 寿延,"Muramatu, Tosinobu"
7,2次元非有界領域におけるNavier-Stokes流の強解の減衰について(偏微分方程式の解の構造の研究),http://www.kurims.kyoto-u.ac.jp/~kyodo/kokyuroku/contents/pdf/0795-07.pdf,"九州大学教養学部,名古屋大学理学部","小薗 英雄,小川 卓克","Kozono, Hideo,Ogawa, Takayoshi"
8,振動積分の$L^2$有界性(偏微分方程式の解の構造の研究),http://www.kurims.kyoto-u.ac.jp/~kyodo/kokyuroku/contents/pdf/0795-08.pdf,千葉経済短期大学,浅田 健嗣,"Asada, Kenji"
9,Decay and Asymptotics for Wave Equations with Nonlinear Damping Term,http://www.kurims.kyoto-u.ac.jp/~kyodo/kokyuroku/contents/pdf/0795-09.pdf,"信州大学理学部,東京外国語大学留学生教育教材開発センター","望月 清,甕 隆博","Mochizuki, Kiyoshi,Motai, Takahiro"
