No.,title,link,Affiliation,Author in JPN,Author in ENG
1,半単純Lie群の指標の間の一次関係について(指標をめぐる数学的手法),http://www.kurims.kyoto-u.ac.jp/~kyodo/kokyuroku/contents/pdf/0826-01.pdf,"福井大学教育学部,京都大学理学部,京都大学総合人間学部",",,","三上 俊介[述],寺田 順子[記],西山 亨[記]"
2,Orbital decomposition of an affine symmetric space,http://www.kurims.kyoto-u.ac.jp/~kyodo/kokyuroku/contents/pdf/0826-02.pdf,"東京大学大学院数理科学研究科,東京大学大学院数理科学研究科","飯田 正敏[述],山本 敦子[記]","Iida, Masatoshi,Yamamoto, Atsuko"
3,Associated Varieties and Gelfand-Kirillov Dimensions for the Discrete Series of a Semisimple Lie Group : To the memory of Mr. Atsushi Yamaguchi,http://www.kurims.kyoto-u.ac.jp/~kyodo/kokyuroku/contents/pdf/0826-03.pdf,京都大学理学部,山下 博,"YAMASHITA, Hiroshi"
4,Plancherel formula for line bundles on Hermitian symmetric spaces,http://www.kurims.kyoto-u.ac.jp/~kyodo/kokyuroku/contents/pdf/0826-04.pdf,東京大学大学院数理科学研究科,示野 信一,"Shimeno, Nobukazu"
5,指標の幾何的計算方法(指標をめぐる数学的手法),http://www.kurims.kyoto-u.ac.jp/~kyodo/kokyuroku/contents/pdf/0826-05.pdf,"立教大学理学部,東京大学大学院数理科学研究科","落合 啓之[述],示野 信一[記]","OCHIAI, HIROYUKI,SHIMENO, NOBUKAZU"
6,"Character of a singular unitary highest weight representation of $Sp(n,\mathbb{R})$.",http://www.kurims.kyoto-u.ac.jp/~kyodo/kokyuroku/contents/pdf/0826-06.pdf,"京都大学総合人間学部,京都大学理学部",",","西山 亨[述],志村 弘之[記]"
7,"On character identities in some enlarged L-packets for SU(2,2)",http://www.kurims.kyoto-u.ac.jp/~kyodo/kokyuroku/contents/pdf/0826-07.pdf,"Faculty of Education, Fukui University",,"MIKAMI, SHUNSUKE"
8,"$SU$(2,2)における旗多様体上の$K_\mathbb{C}$-orbit とBruhat cellとの共通部分について(指標をめぐる数学的手法)",http://www.kurims.kyoto-u.ac.jp/~kyodo/kokyuroku/contents/pdf/0826-08.pdf,立教大学理学部,,落合 啓之
