No.,title,link,Affiliation,Author in JPN,Author in ENG
1,A NORMALIZATION-PROCEDURE FOR THE FIRST ORDER CLASSICAL NATURAL DEDUCTION WITH FULL LOGICAL SYMBOLS,http://www.kurims.kyoto-u.ac.jp/~kyodo/kokyuroku/contents/pdf/0847-01.pdf,"Institute of Mathematics, University of Tsukuba",安東 祐希,"ANDOU, YUUKI"
2,Contraction-Elimination Theorem,http://www.kurims.kyoto-u.ac.jp/~kyodo/kokyuroku/contents/pdf/0847-02.pdf,東京工業大学理学部情報科学科,鹿島 亮,"Kashima, Ryo"
3,Subrecursion theory における dilation について(証明論と逆数学),http://www.kurims.kyoto-u.ac.jp/~kyodo/kokyuroku/contents/pdf/0847-03.pdf,熊本大学工学部,角田 法也,"Kadota, Noriya"
4,Berry's paradox and the incompleteness theorem,http://www.kurims.kyoto-u.ac.jp/~kyodo/kokyuroku/contents/pdf/0847-04.pdf,東北大学理学部,菊池 誠,"KIKUCHI, MAKOTO"
5,PA 上の non-principal prime filter quantifier の強さについて(証明論と逆数学),http://www.kurims.kyoto-u.ac.jp/~kyodo/kokyuroku/contents/pdf/0847-05.pdf,日本大学理工学部,志村 立矢,"SHIMURA, Tatsuya"
6,Large Set Principles and Well-founded Principles,http://www.kurims.kyoto-u.ac.jp/~kyodo/kokyuroku/contents/pdf/0847-06.pdf,下関市立大学,下田 守,"SHIMODA, Mamoru"
7,切断除去による計算可能性の証明(証明論と逆数学),http://www.kurims.kyoto-u.ac.jp/~kyodo/kokyuroku/contents/pdf/0847-07.pdf,東北大学大学院理学研究科,竹内 泉,"Takeuti, Izumi"
8,2階算術の諸体系:モデル論的手法による分析 その2(証明論と逆数学),http://www.kurims.kyoto-u.ac.jp/~kyodo/kokyuroku/contents/pdf/0847-08.pdf,東北大学理学部数学科,田中 一之,"Tanaka, Kazuyuki"
