No.,title,link,Affiliation,Author in JPN,Author in ENG
1,非線型差分方程式の局所的理論について (常微分方程式における大域的理論について),http://www.kurims.kyoto-u.ac.jp/~kyodo/kokyuroku/contents/pdf/0087-01.pdf,東京都立大学理学部,高野 恭一,"TAKANO,KYOICHI"
2,差分方程式$y(x+1)=y(x)+1+\frac{\lambda}{y(x)}$について (常微分方程式における大域的理論について),http://www.kurims.kyoto-u.ac.jp/~kyodo/kokyuroku/contents/pdf/0087-02.pdf,東京大学理学部,木村 俊房,"KIMURA,TOSHIFUSA"
3,Integral Manifolds for Linear Functional Differential Equations (常微分方程式における大域的理論について),http://www.kurims.kyoto-u.ac.jp/~kyodo/kokyuroku/contents/pdf/0087-03.pdf,東北大学理学部,内藤 敏機,"NAITO,TOSHIKI"
4,概周期系の一様漸近安定性と全安定性について (常微分方程式における大域的理論について),http://www.kurims.kyoto-u.ac.jp/~kyodo/kokyuroku/contents/pdf/0087-04.pdf,東北大学理学部,加藤 順二,"KATO,JUNJI"
5,平面におけるCharacteristic $O^+$の流れ (常微分方程式における大域的理論について),http://www.kurims.kyoto-u.ac.jp/~kyodo/kokyuroku/contents/pdf/0087-05.pdf,神戸大学理学部,浦 太郎,"URA,TARO"
6,Subharmonic Solutions to Weakly Nonlinear Duffing's Equation (常微分方程式における大域的理論について),http://www.kurims.kyoto-u.ac.jp/~kyodo/kokyuroku/contents/pdf/0087-06.pdf,京都大学数理解析研究所,占部 実,"URABE,MINORU"
