No.,title,link,Affiliation,Author in JPN,Author in ENG
1,Wavelets and Acoustical Signal Analysis(The State of the Art of Scientific Computing and Its Prospect),http://www.kurims.kyoto-u.ac.jp/~kyodo/kokyuroku/contents/pdf/0880-01.pdf,"IBM Tokyo Research Laboratory,IBM Tokyo Research Laboratory","小林 メイ,阪本 正治","Kobayashi, Mei,Sakamoto, Masaharu"
2,Biarc Spline Interpolation(The State of the Art of Scientific Computing and Its Prospect),http://www.kurims.kyoto-u.ac.jp/~kyodo/kokyuroku/contents/pdf/0880-02.pdf,鹿児島大学理学部,酒井 宦,"Sakai, Manabu"
3,無限区間における補間についての考察(数値計算アルゴリズムの現状と展望),http://www.kurims.kyoto-u.ac.jp/~kyodo/kokyuroku/contents/pdf/0880-03.pdf,"東京大学工学部物理工学科,東京大学工学部物理工学科","緒方 秀教,杉原 正顕","Ogata, Hidenori,Sugihara, Masaaki"
4,収束の加速法(数値計算アルゴリズムの現状と展望),http://www.kurims.kyoto-u.ac.jp/~kyodo/kokyuroku/contents/pdf/0880-04.pdf,長崎総合科学大学,長田 直樹,"Osada, Naoki"
5,非対称行列の積型反復解法をめぐって(数値計算アルゴリズムの現状と展望),http://www.kurims.kyoto-u.ac.jp/~kyodo/kokyuroku/contents/pdf/0880-05.pdf,"名古屋大学工学部,計算流体力学研究所","張 紹良,藤野 清次","ZHANG, SHAO-LIANG,FUJINO, SEIJI"
6,オペレータ係数法について(数値計算アルゴリズムの現状と展望),http://www.kurims.kyoto-u.ac.jp/~kyodo/kokyuroku/contents/pdf/0880-06.pdf,慶應義塾大学理工学部,野寺 隆,"Nodera, Takashi"
7,非対称係数連立一次方程式に対する反復解法の概観(数値計算アルゴリズムの現状と展望),http://www.kurims.kyoto-u.ac.jp/~kyodo/kokyuroku/contents/pdf/0880-07.pdf,"岡山理科大学,岡山理科大学,順正短期大学","仁木 滉,河野 敏行,薄井 正孝","Niki, Hiroshi,Kohno, Toshiyuki,Usui, Masataka"
8,周期境界値問題に対する特異および特異に近い差分行列のSOR法(数値計算アルゴリズムの現状と展望),http://www.kurims.kyoto-u.ac.jp/~kyodo/kokyuroku/contents/pdf/0880-08.pdf,"大阪女子大学,大阪女子大学","石原 和夫,山本 慎","Ishihara, Kazuo,Yamamoto, Makoto"
9,大気モデルにおける数値計算法(数値計算アルゴリズムの現状と展望),http://www.kurims.kyoto-u.ac.jp/~kyodo/kokyuroku/contents/pdf/0880-09.pdf,気象庁数値予報課,露木 義,"Tsuyuki, Tadashi"
10,数値等角写像のためのSymmとHough & Papamichaelの定式化の比較(数値計算アルゴリズムの現状と展望),http://www.kurims.kyoto-u.ac.jp/~kyodo/kokyuroku/contents/pdf/0880-10.pdf,愛媛大学工学部,天野 要,"Amano, Kaname"
11,差分スキームの再考によるベクトル計算機向き不完全LU分解について(数値計算アルゴリズムの現状と展望),http://www.kurims.kyoto-u.ac.jp/~kyodo/kokyuroku/contents/pdf/0880-11.pdf,"計算流体力学研究所,花王","藤野 清次,竹内 敏己","Fujino, Seiji,Takeuchi, Toshimi"
12,差分スキームの構成法の再考:非線形偏微分方程式の安定な数値計算(数値計算アルゴリズムの現状と展望),http://www.kurims.kyoto-u.ac.jp/~kyodo/kokyuroku/contents/pdf/0880-12.pdf,"東京大学工学部物理工学科,東京大学工学部物理工学科","降旗 大介,森 正武","Furihata, Daisuke,Mori, Masatake"
13,非線形楕円型境界値問題の不安定解に対する有限要素近似(数値計算アルゴリズムの現状と展望),http://www.kurims.kyoto-u.ac.jp/~kyodo/kokyuroku/contents/pdf/0880-13.pdf,学習院大学理学部,水谷 明,"Mizutani, Akira"
14,重調和ディリクレ問題に対する数値ー数式ハイブリッド法:LISPによる偏微分方程式の数値一般解の構成法(数値計算アルゴリズムの現状と展望),http://www.kurims.kyoto-u.ac.jp/~kyodo/kokyuroku/contents/pdf/0880-14.pdf,城西大学理学部,天野 一男,"Amano, Kazuo"
15,Eigenvalue problems arising from two-component flow(The State of the Art of Scientific Computing and Its Prospect),http://www.kurims.kyoto-u.ac.jp/~kyodo/kokyuroku/contents/pdf/0880-15.pdf,"Department of Mathematics, Kyoto University,Department of Mathematics, Kyoto University,Department of Mathematics, Kyoto University","幡谷 泰史,西田 孝明,寺本 恵昭","HATAYA, Yasushi,NISHIDA, Takaaki,TERAMOTO, Yoshiaki"
16,非凸領域における楕円型方程式の解の数値的検証法(数値計算アルゴリズムの現状と展望),http://www.kurims.kyoto-u.ac.jp/~kyodo/kokyuroku/contents/pdf/0880-16.pdf,"九州大学理学部,九州大学理学部","山本 野人,中尾 充宏","Yamamoto, Nobito,Nakao, Mitsuhiro"
17,区間解析を用いた非線形常微分方程式に対する境界値問題の解の存在の数値的検証法(数値計算アルゴリズムの現状と展望),http://www.kurims.kyoto-u.ac.jp/~kyodo/kokyuroku/contents/pdf/0880-17.pdf,早稲田大学理工学部情報学科,大石 進一,"Oishi, Shin'ichi"
18,常微分方程式の大きなシステムに対する補外法の有効性(数値計算アルゴリズムの現状と展望),http://www.kurims.kyoto-u.ac.jp/~kyodo/kokyuroku/contents/pdf/0880-18.pdf,"Department of Applied Science, Yamaguchi University",スプリヨノ,Supriyono
19,Variable coefficient Explicit Runge-Kutta Methods(The State of the Art of Scientific Computing and Its Prospect),http://www.kurims.kyoto-u.ac.jp/~kyodo/kokyuroku/contents/pdf/0880-19.pdf,鹿児島大学理学部,中島 正治,"Nakashima, Masaharu"
20,多変数関数を一変数関数の和で表現するアルゴリズム(数値計算アルゴリズムの現状と展望),http://www.kurims.kyoto-u.ac.jp/~kyodo/kokyuroku/contents/pdf/0880-20.pdf,群馬大学工学部情報工学科,山村 清隆,"Yamamura, Kiyotaka"
21,強単調な非線形方程式に対するホモトピー法の事前評価(数値計算アルゴリズムの現状と展望),http://www.kurims.kyoto-u.ac.jp/~kyodo/kokyuroku/contents/pdf/0880-21.pdf,中央大学理工学部,牧野 光則,"Makino, Mitsunori"
22,汎用超並列計算機の上での大規模数値計算:QCD_TAROプロジェクトの経験から(数値計算アルゴリズムの現状と展望),http://www.kurims.kyoto-u.ac.jp/~kyodo/kokyuroku/contents/pdf/0880-22.pdf,山形大学教育学部,中村 純,"NAKAMURA, Atsushi"
23,準線形固有値問題の反復解法について(数値計算アルゴリズムの現状と展望),http://www.kurims.kyoto-u.ac.jp/~kyodo/kokyuroku/contents/pdf/0880-23.pdf,"岡山理科大学理学部,岡山理科大学理学部","澤見 英男,仁木 滉","Sawami, Hideo,Niki, Hiroshi"
24,A modification of Gauss-Newton method for nonlinear least squares problems(The State of the Art of Scientific Computing and Its Prospect),http://www.kurims.kyoto-u.ac.jp/~kyodo/kokyuroku/contents/pdf/0880-24.pdf,"東京理科大学工学部,システム計画研究所","矢部 博,八巻 直一","YABE, Hiroshi,YAMAKI, Naokazu"
25,準Newton法を使用した主双対内点法の局所的収束の速さについて(数値計算アルゴリズムの現状と展望),http://www.kurims.kyoto-u.ac.jp/~kyodo/kokyuroku/contents/pdf/0880-25.pdf,"東京理科大学工学部,株式会社数理システム","矢部 博,山下 浩","Yabe,Hiroshi,Yamashita, Hiroshi"
26,Pade展開は本当に有用なのか(数値計算アルゴリズムの現状と展望),http://www.kurims.kyoto-u.ac.jp/~kyodo/kokyuroku/contents/pdf/0880-26.pdf,電気通信大学情報工学科,浜田 穂積,"HAMADA, Hozumi"
