No.,title,link,Affiliation,Author in JPN,Author in ENG
1,Generalized Airy-Weber Functions,http://www.kurims.kyoto-u.ac.jp/~kyodo/kokyuroku/contents/pdf/0894-01.pdf,"RIMS, Kyoto University",,"DUC, NGUYEN HUU"
2,超分布の調和解析について(超函数と微分方程式),http://www.kurims.kyoto-u.ac.jp/~kyodo/kokyuroku/contents/pdf/0894-02.pdf,東京大学大学院数理科学研究科,栄田 厚彦,"Eida, Atsuhiko"
3,Microdifferential Equations with Non-Involutive Factors,http://www.kurims.kyoto-u.ac.jp/~kyodo/kokyuroku/contents/pdf/0894-03.pdf,防衛大学,打越 敬祐,"Uchikoshi, Keisuke"
4,THE ACOUSTIC WAVE PROPAGATION IN TWO UNBOUNDED MEDIA,http://www.kurims.kyoto-u.ac.jp/~kyodo/kokyuroku/contents/pdf/0894-04.pdf,筑波大学大学院,門脇 光輝,"KADOWAKI, MITSUTERU"
5,The Cauchy problem fir hyperbolic operators of strong type,http://www.kurims.kyoto-u.ac.jp/~kyodo/kokyuroku/contents/pdf/0894-05.pdf,"Institute of Mathematics, University of Tsukuba,Department of Mathematics, College of General Education, Osaka University,Institute of Mathematics, University of Tsukuba","梶谷 邦彦,西谷 達雄,若林 誠一郎","KAJITANI, KUNIHIKO,NISHITANI, TATSUO,WAKABAYASHI, SEIICHIRO"
6,ある滑らかに対角化できないLevi形式をもつ擬凸領域における$\bar{\partial}$-Neumann問題(超函数と微分方程式),http://www.kurims.kyoto-u.ac.jp/~kyodo/kokyuroku/contents/pdf/0894-06.pdf,工学院大学,長谷川 研二,"HASEGAWA, Kenji"
7,ALGORITHMIC METHODS IN THE BOUNDARY VALUE PROBLEM FOR SYSTEMS OF LINEAR PARTIAL DIFFERENTIAL EQUATIONS WITH REGULAR SINGULARITIES,http://www.kurims.kyoto-u.ac.jp/~kyodo/kokyuroku/contents/pdf/0894-07.pdf,"Department of Mathematics, Yokohama City University",大阿久 俊則,"OAKU, TOSHINORI"
